sentence_id,medical,are,treated,treatment,medical_first_index,medical_last_index,are_first_index,are_last_index,treated_first_index,treated_last_index,treatment_first_index,treatment_last_index,sentence_text
183515701,severe pulmonary arterial hypertension,are,treated,intravenous or subcutaneous treprostinil,3,6,10,10,11,11,16,19,Pediatric patients with severe pulmonary arterial hypertension ( PAH ) are treated with intravenous epoprostenol or intravenous or subcutaneous treprostinil .
183860920,inguinal lymph nodes of unknown origin,are,treated,radiation therapy,3,8,9,9,11,11,13,14,The patients with inguinal lymph nodes of unknown origin are usually treated with radiation therapy .
184072397,advanced gynaecological cancer,are,treated,a temporary interstitial implant,2,4,5,5,7,7,9,12,Patients with advanced gynaecological cancer are often treated with a temporary interstitial implant using the Syed template and Ir- 192 ribbons at the Memorial Sloan-Kettering Cancer Center .
184098593,polymetastatic cancer,are,treated,systemic therapy,2,3,4,4,7,7,9,10,"Patients with polymetastatic cancer are most often treated with systemic therapy to improve overall survival and/or delay progression , with palliative radiotherapy reserved for sites of symptomatic disease ."
184241723,hepatocellular carcinoma,are,treated,sorafenib,11,12,14,14,15,15,17,17,The prognostic role of lactate dehydrogenase serum levels in patients with hepatocellular carcinoma who are treated with sorafenib : the influence of liver fibrosis .
184262443,acute lymphoblastic leukemia,are,treated,intermittent steroid therapy,2,4,8,8,9,9,11,13,Children with acute lymphoblastic leukemia ( ALL ) are treated with intermittent steroid therapy .
184294423,metastatic disease,are,treated,systemic chemotherapy,16,17,18,18,19,19,21,22,"Surgery and radiation therapy are the accepted treatments for most sarcomas ; however , patients with metastatic disease are treated with systemic chemotherapy ."
184432620,a dysfunctional RVOT conduit,are,treated,implantation of a Melody valve,2,5,8,8,11,11,14,18,Patients with a dysfunctional RVOT conduit or BPV are now routinely treated percutaneously with implantation of a Melody valve .
184673601,the ' classical ' gastrointestinal symptoms of coeliac disease,are,treated,a gluten exclusion diet,2,10,14,14,19,19,21,24,Patients with the ' classical ' gastrointestinal symptoms of coeliac disease ( CD ) are usually readily diagnosed and treated with a gluten exclusion diet .
184868674,severe SBS,is,treated,planned secondary surgical intervention,12,13,15,15,21,21,24,27,Prolonged survival and normal development can be expected for the patient with severe SBS who is given meticulous nutritional support and treated with carefully planned secondary surgical intervention .
185254657,severe aplastic anemia,are,treated,allogeneic blood,7,9,13,13,14,14,16,17,Children with bone marrow failure syndromes and severe aplastic anemia ( SAA ) are treated with allogeneic blood or marrow transplantation ( BMT ) .
185254657,severe aplastic anemia,are,treated,marrow transplantation,7,9,13,13,14,14,19,20,Children with bone marrow failure syndromes and severe aplastic anemia ( SAA ) are treated with allogeneic blood or marrow transplantation ( BMT ) .
185255715,magnetic resonance imaging-proven ischemic stroke,are,treated,intravenous alteplase,3,7,11,11,12,12,14,15,"Only patients with magnetic resonance imaging-proven ischemic stroke , who subsequently are treated with intravenous alteplase , and in selected cases additional endovascular treatment , are finally included in the study ."
185448827,an abnormal illusion of movement response,are,treated,eye movement desensitization,5,10,16,16,17,17,19,21,"When psychiatric patients with both an abnormal illusion of movement response and an RSM of trauma are treated with eye movement desensitization , both symptoms are removed in 70 % of cases ; when these patients undergo some other form of treatment , both symptoms are removed in 30 % of cases ."
185677945,rheumatoid arthritis,are,treated,disease-modifying antirheumatic drugs,11,12,16,16,19,19,21,23,"Despite the importance of achieving tight control , many patients with rheumatoid arthritis ( RA ) are not effectively treated with disease-modifying antirheumatic drugs ."
185882875,modest extensions,are,treated,a more minimalistic type of approach,6,7,14,14,16,16,18,23,"Finally , some tumors with more modest extensions outside the bounds of the sella are now treated with a more minimalistic type of approach via a small incision in the eyebrow ."
185899933,metastatic solid tumors,are,treated,palliative intent,2,4,5,5,7,7,9,10,Patients with metastatic solid tumors are usually treated with palliative intent .
185911587,isolated systolic hypertension,are,treated,blood pressure lowering agents,17,19,20,20,21,21,23,26,"Finally , reduced risk of fatal and non-fatal cardiovascular events have been demonstrated when diabetic patients with isolated systolic hypertension are treated with blood pressure lowering agents ."
185996632,esophageal carcinoma,are,treated,definitive chemoradiotherapy,2,3,8,8,9,9,11,12,Patients with esophageal carcinoma ( EC ) who are treated with definitive chemoradiotherapy ( bimodality therapy [ BMT ] ) experience frequent relapses .
186343860,Prader-Willi syndrome,are,treated,GH,2,3,7,7,9,9,11,11,Children with Prader-Willi syndrome ( PWS ) are routinely treated with GH and have a response comparable with that observed in children with GH deficiency ( GHD ) .
186601659,unresectable and/or metastatic pancreatic cancer,are,treated,5-fluorouracil-based regimens,2,6,7,7,10,10,12,13,Patients with unresectable and/or metastatic pancreatic cancer are most frequently treated with 5-fluorouracil-based regimens which have produced little palliation with no improvement in overall survival .
186617985,localized prostate cancer,are,treated,radiotherapy,3,5,9,9,12,12,14,14,Contemporary patients with localized prostate cancer ( PCa ) are more frequently treated with radiotherapy .
186711613,signficant competing medical risks,are,treated,surgery,6,9,11,11,13,13,15,15,"Although older patients or those with signficant competing medical risks typically are not treated with surgery or radiation , active surveillance should also be considered and explained to well-selected healthy patients otherwise considering primary therapy ."
187033585,additional intracranial large artery occlusion,is,treated,a mechanical endovascular approach,18,22,23,23,25,25,27,30,Acute major stroke with high-grade stenosis or occlusion of the extracranial internal carotid artery ( ICA ) and additional intracranial large artery occlusion is increasingly treated with a mechanical endovascular approach by extracranial stenting and intracranial thrombectomy due to poor response to systemic thrombolysis with recombinant tissue plasminogen activator ( rtPA ) .
187033585,high-grade stenosis or occlusion of the extracranial internal carotid artery,is,treated,a mechanical endovascular approach,4,13,23,23,25,25,27,30,Acute major stroke with high-grade stenosis or occlusion of the extracranial internal carotid artery ( ICA ) and additional intracranial large artery occlusion is increasingly treated with a mechanical endovascular approach by extracranial stenting and intracranial thrombectomy due to poor response to systemic thrombolysis with recombinant tissue plasminogen activator ( rtPA ) .
187147322,localised oesophageal cancer,are,treated,surgery,3,5,6,6,7,7,16,16,Some patients with localised oesophageal cancer are treated with definitive chemoradiotherapy ( CRT ) rather than surgery .
187147322,localised oesophageal cancer,are,treated,definitive chemoradiotherapy,3,5,6,6,7,7,9,10,Some patients with localised oesophageal cancer are treated with definitive chemoradiotherapy ( CRT ) rather than surgery .
187153132,"superficial , painful wounds",are,treated,analgesics,9,12,24,24,25,25,27,27,"Approximately 20 to 25 % of the patients with superficial , painful wounds , complain of increased pain during treatment with maggots , and are treated with analgesics ."
187215843,bacterial pneumonia,are,treated,parenteral broad-spectrum antimicrobials,2,3,5,5,6,6,9,11,Patients with bacterial pneumonia often are treated empirically with parenteral broad-spectrum antimicrobials intended to cover potential gram-negative and gram-positive pathogens .
187219489,Philadelphia chromosome-positive acute lymphoblastic leukemia,are,treated,chemotherapy,12,16,22,22,23,23,25,25,Disease recurrence occurs in 20 % to 40 % of adults with Philadelphia chromosome-positive acute lymphoblastic leukemia ( Ph+ ALL ) who are treated with chemotherapy and tyrosine kinase inhibitors ( TKIs ) .
187219489,Philadelphia chromosome-positive acute lymphoblastic leukemia,are,treated,tyrosine kinase inhibitors,12,16,22,22,23,23,27,29,Disease recurrence occurs in 20 % to 40 % of adults with Philadelphia chromosome-positive acute lymphoblastic leukemia ( Ph+ ALL ) who are treated with chemotherapy and tyrosine kinase inhibitors ( TKIs ) .
187255406,crotaline snake envenomation,are,treated,Crotalidae polyvalent immune Fab ( ovine ) antivenom,7,9,11,11,12,12,14,21,We estimate the proportion of patients with crotaline snake envenomation who are treated with Crotalidae polyvalent immune Fab ( ovine ) antivenom and who develop medically significant late bleeding .
187451436,early Alzheimer disease,are,treated,a cholinesterase inhibitor,11,13,18,18,19,19,21,23,To evaluate the efficacy of a cognitive-motor program in patients with early Alzheimer disease ( AD ) who are treated with a cholinesterase inhibitor ( ChEI ) .
187651520,idiopathic pulmonary fibrosis,are,treated,pirfenidone,15,17,19,19,20,20,22,22,Gastrointestinal ( GI ) adverse events ( AEs ) are commonly reported in patients with idiopathic pulmonary fibrosis who are treated with pirfenidone .
187677421,diffuse panbronchiolitis,are,treated,erythromycin,2,3,7,7,9,9,11,11,"Patients with diffuse panbronchiolitis ( DPB ) are routinely treated with erythromycin , clarithromycin , and roxithromycin ."
187677421,diffuse panbronchiolitis,are,treated,clarithromycin,2,3,7,7,9,9,13,13,"Patients with diffuse panbronchiolitis ( DPB ) are routinely treated with erythromycin , clarithromycin , and roxithromycin ."
187677421,diffuse panbronchiolitis,are,treated,roxithromycin,2,3,7,7,9,9,16,16,"Patients with diffuse panbronchiolitis ( DPB ) are routinely treated with erythromycin , clarithromycin , and roxithromycin ."
187697109,limited food intake,is,treated,cognitive-behavioral therapy,11,13,14,14,16,16,18,19,The authors present a case in which a female patient with limited food intake is successfully treated with cognitive-behavioral therapy .
187800730,chronic wrist pain,are,treated,wrist denervation,2,4,6,6,7,7,9,10,"Patients with chronic wrist pain often are treated with wrist denervation , which typically involves transecting both the anterior interosseous nerve ( AIN ) and the posterior interosseous nerve ."
187803994,upper tract transitional cell carcinoma,are,treated,ureteroscopic resection,6,10,11,11,12,12,14,15,A select group of patients with upper tract transitional cell carcinoma are treated with ureteroscopic resection .
188298060,severe aortic valve stenosis,are,treated,2 different interventional techniques,2,5,6,6,8,8,10,13,Patients with severe aortic valve stenosis are currently treated with 2 different interventional techniques : surgical aortic valve replacement or transcatheter aortic valve implantation ( TAVI ) .
188488291,resultant valgus instability in throwing athletes,is,treated,free tendon graft reconstruction,8,13,14,14,16,16,18,21,Medial collateral ligament insufficiency of the elbow with resultant valgus instability in throwing athletes is typically treated with free tendon graft reconstruction as described by Jobe .
188594512,acute uncomplicated urine infection,are,treated,antibiotics,2,5,6,6,8,8,10,10,Women with acute uncomplicated urine infection are usually treated with antibiotics .
188883751,neoplastic meningosis,are,treated,a combination of radiation,2,3,4,4,6,6,8,11,"Patients with neoplastic meningosis are frequently treated with a combination of radiation and chemotherapy , and/or may have been irradiated to the nervous system in the past ."
188906524,curable esophageal cancer,are,treated,neoadjuvant chemoradiotherapy,2,4,26,26,28,28,30,31,Patients with curable esophageal cancer ( EC ) who proceed beyond the original Chemoradiotherapy for Oesophageal Cancer Followed by Surgery Study ( CROSS ) eligibility criteria are also treated with neoadjuvant chemoradiotherapy ( nCRT ) .
188997190,multiple myeloma,are,treated,idiotype-based dendritic cell ( Id/DC ) vaccination,12,13,15,15,16,16,18,24,This overview will summarize published and ongoing clinical trials in patients with multiple myeloma who are treated with idiotype-based dendritic cell ( Id/DC ) vaccination .
189175746,chronic kidney disease,are,treated,dialyzers,5,7,8,8,10,10,12,12,The majority of patients with chronic kidney disease are currently treated with dialyzers containing synthetic membranes .
189195877,chronic or recurrent otitis media,are,treated,long-term ventilation tubes,2,6,19,19,21,21,23,25,Patients with chronic or recurrent otitis media with effusion who do not respond to treatment with conventional ventilation tubes are often treated with long-term ventilation tubes .
189209228,deep hand burns,are,treated,full-thickness or split-thickness skin grafts,3,5,6,6,7,7,9,13,Some patients with deep hand burns are treated with full-thickness or split-thickness skin grafts .
189361335,resectable tumors,are,treated,adjuvant chemotherapy,3,4,5,5,7,7,12,13,Patients with incompletely resectable tumors are best treated with definitive RT and adjuvant chemotherapy .
189361335,resectable tumors,are,treated,definitive RT,3,4,5,5,7,7,9,10,Patients with incompletely resectable tumors are best treated with definitive RT and adjuvant chemotherapy .
189732903,non-1 genotypes,are,treated,dual therapy,2,3,4,4,5,5,7,8,"Patients with non-1 genotypes are treated with dual therapy ( without protease inhibitors ) for a genotype and response driven duration of 16 , 24 , 48 , or 72 week ."
190150786,borderline ( BR ) or locally advanced ( LA ) pancreatic adenocarcinoma,are,treated,induction FOLFIRINOX,2,13,17,17,19,19,21,22,Patients with borderline ( BR ) or locally advanced ( LA ) pancreatic adenocarcinoma ( PAC ) are often treated with induction FOLFIRINOX ( FLX ) .
190256355,neuroendocrine tumors,are,treated,somatostatin analogs,2,3,7,7,9,9,11,12,Patients with neuroendocrine tumors ( NETs ) are often treated with somatostatin analogs ( SSAs ) for control of symptoms and tumor growth .
190269335,treatment resistant depression,are,treated,short course intravenous ketamine,9,11,19,19,21,21,23,26,A case series is presented where six patients with treatment resistant depression failing both electroconvulsive therapy and oral antidepressants are concomitantly treated with short course intravenous ketamine and longer term selegiline transdermal system .
190269335,treatment resistant depression,are,treated,longer term selegiline transdermal system,9,11,19,19,21,21,28,32,A case series is presented where six patients with treatment resistant depression failing both electroconvulsive therapy and oral antidepressants are concomitantly treated with short course intravenous ketamine and longer term selegiline transdermal system .
190493894,acute ischaemic stroke,are,treated,warfarin,11,13,15,15,16,16,18,18,It is uncertain whether thrombolytic therapy is safe in patients with acute ischaemic stroke who are treated with warfarin and have a subtherapeutic international normalised ratio ( INR ) at stroke onset .
190705393,sickle cell disease,are,treated,opioids,2,4,8,8,10,10,12,12,Patients with sickle cell disease ( SCD ) are often treated with opioids for severe pain .
190870989,anti-GBM disease,are,treated,plasmapheresis,4,5,6,6,8,8,10,10,"However , patients with anti-GBM disease are also treated with plasmapheresis early in the disease presentation to prevent further damage ."
190994308,unresectable disease,are,treated,radiotherapy,4,5,6,6,7,7,25,25,"Frequently , patients with unresectable disease are treated with symptomatic care alone or , in the case of locally advanced , unresectable lesions , with radiotherapy alone ."
190994308,unresectable disease,are,treated,symptomatic care,4,5,6,6,7,7,9,10,"Frequently , patients with unresectable disease are treated with symptomatic care alone or , in the case of locally advanced , unresectable lesions , with radiotherapy alone ."
191077975,negative bone marrows,are,treated,involved field radiation therapy,8,10,11,11,13,13,15,18,Patients with 1 to 3 bone lesions and negative bone marrows are often treated with involved field radiation therapy as the initial and potentially definitive therapy .
191226336,unresectable advanced carcinoma of the uterine cervix,are,treated,chemotherapy,2,8,9,9,11,11,13,13,Patients with unresectable advanced carcinoma of the uterine cervix are usually treated with chemotherapy or chemoradiotherapy .
191226336,unresectable advanced carcinoma of the uterine cervix,are,treated,chemoradiotherapy,2,8,9,9,11,11,15,15,Patients with unresectable advanced carcinoma of the uterine cervix are usually treated with chemotherapy or chemoradiotherapy .
191589516,severe and moderate haemophilia A,are,treated,factor VIII ( FVIII ) concentrate,2,6,7,7,8,8,11,16,Patients with severe and moderate haemophilia A are treated prophylactically with factor VIII ( FVIII ) concentrate .
191622077,complicated gram-positive endocarditis,are,treated,a combination of surgical procedure,2,4,5,5,7,7,9,13,Patients with complicated gram-positive endocarditis are usually treated with a combination of surgical procedure and long-term antibiotic therapy with intravenous vancomycin .
191637809,refractory or relapsed disease,are,treated,HLA haploidentical BMT,2,5,6,6,8,8,10,12,Patients with refractory or relapsed disease are increasingly treated with HLA haploidentical BMT .
192009678,advanced melanoma,are,treated,PD-1 inhibitors,3,4,6,6,7,7,9,10,"In patients with advanced melanoma who are treated with PD-1 inhibitors , the development of vitiligo-like lesions has been proved to be associated with improved progression-free and overall survival rates ( 4,5 ) ."
192135882,paradoxical embolism,are,treated,anticoagulant,23,24,25,25,27,27,29,29,"Direct-acting oral anticoagulants are not significantly more likely than aspirin to cause severe hemorrhage , and it is now clear that patients with paradoxical embolism are better treated with anticoagulant than aspirin ."
192365714,severe haemophilia,are,treated,recombinant products,9,10,12,12,13,13,15,16,There are 65.0 % ( 191 ) patients with severe haemophilia who are treated with recombinant products .
192452820,chronic hepatitis C,are,treated,interferon (IFN)-α,2,4,5,5,7,7,9,10,Patients with chronic hepatitis C are frequently treated with interferon (IFN)-α .
193160652,symptomatic meningioma,are,treated,tumor resection,2,3,4,4,6,6,8,9,Patients with symptomatic meningioma are usually treated with tumor resection .
193183526,low-grade glioma,are,treated,irradiation,2,3,8,8,10,10,12,12,Patients with low-grade glioma ( LGG ) who are successfully treated with irradiation are at increased risk for cognitive and psychosocial late effects .
193498233,a femoral neck fracture,are,treated,an arthroplasty,16,19,21,21,22,22,24,25,We sought to evaluate the efficacy of an interdisciplinary protocol for the management of patients with a femoral neck fracture who are treated with an arthroplasty .
193504779,good performance status,are,treated,targeted biologic therapy,3,5,6,6,7,7,12,14,Most patients with good performance status are treated with cytotoxic chemotherapy or targeted biologic therapy following or in lieu of repeat surgery .
193504779,good performance status,are,treated,cytotoxic chemotherapy,3,5,6,6,7,7,9,10,Most patients with good performance status are treated with cytotoxic chemotherapy or targeted biologic therapy following or in lieu of repeat surgery .
193762050,acute ischaemic stroke,are,treated,intravenous thrombolysis,11,13,14,14,15,15,17,18,Several studies indicate that only a small proportion of patients with acute ischaemic stroke are treated with intravenous thrombolysis .
193782711,axial and rotational stability,are,treated,intramedullary nailing,6,9,10,10,11,11,13,14,"In our institution , fractures with axial and rotational stability are treated with intramedullary nailing without interlocking ."
193896617,preoperative or intraoperative fracture of the lateral femoral wall,are,treated,a sliding compression hip-screw device,7,15,16,16,18,18,21,25,"Consequently , we concluded that patients with preoperative or intraoperative fracture of the lateral femoral wall are not treated adequately with a sliding compression hip-screw device , and intertrochanteric fractures should therefore be classified according to the integrity of the lateral femoral wall , especially in randomized trials comparing fracture implants ."
194345167,severe or severe disease,are,treated,steroids,3,6,7,7,8,8,10,10,Those with moderately severe or severe disease are treated with steroids and/or orbital radiation during the inflammatory phase and surgical therapy during the inactive phase .
194345167,severe or severe disease,are,treated,orbital radiation,3,6,7,7,8,8,12,13,Those with moderately severe or severe disease are treated with steroids and/or orbital radiation during the inflammatory phase and surgical therapy during the inactive phase .
194378956,large PSP,are,treated,tube thoracostomy,2,3,4,4,5,5,7,8,Patients with large PSP are treated with tube thoracostomy ( TT ) and followed up with x-rays .
194416343,a particular disease,are,treated,certain drugs,8,10,11,11,12,12,14,15,"Data from clinical trials , where patients with a particular disease are treated with certain drugs , can be retrospectively assembled using a case-control design ."
194537734,intestinal bacterial overgrowth,are,treated,different antibiotics,2,4,8,8,10,10,12,13,Patients with intestinal bacterial overgrowth ( SIBO ) are usually treated with different antibiotics .
194628457,acquired,are,treated,active antiretroviral therapy,8,8,12,12,13,13,16,18,Paradoxical reactions of tuberculosis in patients with the acquired immunodeficiency syndrome who are treated with highly active antiretroviral therapy .
194645090,advanced cervical carcinoma,are,treated,cisplatin-containing chemotherapy,2,4,5,5,6,6,11,12,Patients with advanced cervical carcinoma are treated routinely with radiotherapy and cisplatin-containing chemotherapy .
194645090,advanced cervical carcinoma,are,treated,radiotherapy,2,4,5,5,6,6,9,9,Patients with advanced cervical carcinoma are treated routinely with radiotherapy and cisplatin-containing chemotherapy .
194787093,adrenal dysfunction,are,treated,high doses of inhaled corticosteroids,11,12,17,17,18,18,20,24,This is a useful method for frequently monitoring young children with adrenal dysfunction or severe asthma that are treated with high doses of inhaled corticosteroids .
194787093,severe asthma,are,treated,high doses of inhaled corticosteroids,14,15,17,17,18,18,20,24,This is a useful method for frequently monitoring young children with adrenal dysfunction or severe asthma that are treated with high doses of inhaled corticosteroids .
194807530,infective endocarditis,are,treated,intravenous antibiotic agents,2,3,11,11,13,13,15,17,Patients with infective endocarditis on the left side of the heart are typically treated with intravenous antibiotic agents for up to 6 weeks .
194904929,adult T-cell leukemia,are,treated,a monoclonal antibody,26,28,29,29,30,30,32,34,"Because IL-2 receptors are present on the malignant T cells but not on normal resting cells , clinical trials have been initiated in which patients with adult T-cell leukemia are treated with a monoclonal antibody that binds to the IL-2 receptor ."
195005550,obstructive sleep apnea,are,treated,positive airway pressure,2,4,9,9,11,11,13,15,Patients with obstructive sleep apnea ( OSA ) who are not treated with positive airway pressure preoperatively are at increased risks for cardiopulmonary complications after general and vascular surgery .
195220262,progressive metastatic tumors,are,treated,systemic chemotherapy,2,4,8,8,10,10,12,13,Patients with progressive metastatic tumors and overwhelming symptoms are currently treated with systemic chemotherapy and radiopharmaceutical agents such as metaiodobenzylguanidine .
195220262,progressive metastatic tumors,are,treated,radiopharmaceutical agents,2,4,8,8,10,10,15,16,Patients with progressive metastatic tumors and overwhelming symptoms are currently treated with systemic chemotherapy and radiopharmaceutical agents such as metaiodobenzylguanidine .
195220262,overwhelming symptoms,are,treated,systemic chemotherapy,6,7,8,8,10,10,12,13,Patients with progressive metastatic tumors and overwhelming symptoms are currently treated with systemic chemotherapy and radiopharmaceutical agents such as metaiodobenzylguanidine .
195220262,overwhelming symptoms,are,treated,radiopharmaceutical agents,6,7,8,8,10,10,15,16,Patients with progressive metastatic tumors and overwhelming symptoms are currently treated with systemic chemotherapy and radiopharmaceutical agents such as metaiodobenzylguanidine .
195570230,unruptured infectious aneurysms,are,treated,antibiotics,2,4,5,5,7,7,11,11,"Patients with unruptured infectious aneurysms are initially treated medically , with antibiotics and serial angiography ."
195570230,unruptured infectious aneurysms,are,treated,serial angiography,2,4,5,5,7,7,13,14,"Patients with unruptured infectious aneurysms are initially treated medically , with antibiotics and serial angiography ."
