sentence_id,medical,are,treated,treatment,medical_first_index,medical_last_index,are_first_index,are_last_index,treated_first_index,treated_last_index,treatment_first_index,treatment_last_index,sentence_text
90098629,end stage renal disease,are,treated,erythropoietin,4,7,8,8,9,9,11,11,"As more people with end stage renal disease are treated with erythropoietin for their anaemia , a well-coordinated system is essential to monitor their response to treatment ."
90106052,non-ST-elevation acute coronary syndromes,are,treated,similar approaches,2,5,9,9,14,14,16,17,Patients with non-ST-elevation acute coronary syndromes ( ACS ) are typically grouped together and treated with similar approaches to therapy despite tremendous variability in clinical presentation and prognosis .
90495737,a palpable pulse,is,treated,synchronised cardioversion,11,13,14,14,15,15,17,18,"Under current resuscitation guidelines symptomatic ventricular tachycardia ( VT ) with a palpable pulse is treated with synchronised cardioversion to avoid inducing ventricular fibrillation ( VF ) , whilst pulseless VT is treated as VF with rapid administration of full defibrillation energy unsynchronised shocks ."
90684867,the most severe RLS,are,treated,oral opioids.(4,19,22,23,23,25,25,27,28,"First-line treatments of RLS are dopamine agonists , but GABAergic anticonvulsants and opioids are also effective.(2,3 ) Patients with the most severe RLS are often treated with oral opioids.(4 ) The use of these may , however , be limited due to side effects ."
90712762,CD-expressing tumor cells,are,treated,5 fluorocytosine,20,22,23,23,24,24,26,27,"Cytosine deaminase (CD)-based gene therapy has been shown to be effective in decreasing growth of solid tumors when animals with CD-expressing tumor cells are treated with 5 fluorocytosine ( 5FC ) , an inert prodrug that is converted to 5-fluorouracil ( 5FU ) by CD ."
90784805,cerebral palsy,are,treated,intrathecal baclofen,2,3,5,5,6,6,8,9,Children with cerebral palsy who are treated with intrathecal baclofen have a higher rate of cerebrospinal fluid ( CSF ) leaks along the baclofen catheter than do adults treated with intrathecal baclofen .
91033410,reduced ejection fraction,are,treated,sub-optimal doses of angiotensin converting enzyme-inhibitors,7,9,13,13,15,15,17,22,"Heart failure ( HF ) patients with reduced ejection fraction ( HFrEF ) are frequently treated with sub-optimal doses of angiotensin converting enzyme-inhibitors ( ACE-Is ) , angiotensin receptor blockers ( ARBs ) , and beta blockers ( BBs ) ."
91163179,advanced BTC,are,treated,platinum agents,2,3,5,5,6,6,10,11,Patients with advanced BTC who are treated with gemcitabine plus platinum agents may experience better survival outcomes compared with patients who are not treated with this combination of chemotherapy .
91163179,advanced BTC,are,treated,gemcitabine,2,3,5,5,6,6,8,8,Patients with advanced BTC who are treated with gemcitabine plus platinum agents may experience better survival outcomes compared with patients who are not treated with this combination of chemotherapy .
91202010,moderate and severe clinical picture,are,treated,psychotherapy,2,6,7,7,8,8,10,10,Patients with moderate and severe clinical picture are treated with psychotherapy and pharmacological therapy .
91202010,moderate and severe clinical picture,are,treated,pharmacological therapy,2,6,7,7,8,8,12,13,Patients with moderate and severe clinical picture are treated with psychotherapy and pharmacological therapy .
91220474,advanced lung cancer,are,treated,immune checkpoint inhibitors,5,7,8,8,10,10,12,14,"The majority of patients with advanced lung cancer are now treated with immune checkpoint inhibitors or targeted therapies , both of which have had a significant impact on patient 's experience and outcomes ."
91220474,advanced lung cancer,are,treated,targeted therapies,5,7,8,8,10,10,16,17,"The majority of patients with advanced lung cancer are now treated with immune checkpoint inhibitors or targeted therapies , both of which have had a significant impact on patient 's experience and outcomes ."
91337654,no lymphvascular involvement,are,treated,simple hysterectomy,15,17,18,18,20,20,23,24,"In the United States , patients with stromal invasion of less than 3 mm and no lymphvascular involvement are usually treated conservatively with simple hysterectomy ."
91337654,stromal invasion of less than 3 mm,are,treated,simple hysterectomy,7,13,18,18,20,20,23,24,"In the United States , patients with stromal invasion of less than 3 mm and no lymphvascular involvement are usually treated conservatively with simple hysterectomy ."
91704700,presumed paradoxical embolism,are,treated,antithrombotic medications,3,5,6,6,8,8,11,12,"Most patients with presumed paradoxical embolism are currently treated medically with antithrombotic medications , with a paucity of data concerning the efficacy of oral anticoagulant as opposed to antiplatelet therapy ."
91704700,presumed paradoxical embolism,are,treated,a paucity of data,3,5,6,6,8,8,15,18,"Most patients with presumed paradoxical embolism are currently treated medically with antithrombotic medications , with a paucity of data concerning the efficacy of oral anticoagulant as opposed to antiplatelet therapy ."
91887019,inflammatory connective tissue disorders,are,treated,methotrexate,15,18,20,20,21,21,23,23,Consideration of the safety of liver transaminases monitoring every 12   weeks in patients with inflammatory connective tissue disorders who are treated with methotrexate ( MTX ) .
91890275,severe schizophrenia,are,treated,high doses of first-generation antipsychotics,3,4,5,5,7,7,9,13,Long-stay patients with severe schizophrenia are frequently treated with high doses of first-generation antipsychotics ( FGA ) .
92258277,renal diseases,are,treated,glucocorticoids,2,3,5,5,6,6,8,8,Children with renal diseases who are treated with glucocorticoids are at increased risk of developing osteoporosis and fractures .
92290584,narrow QRS,is,treated,pacemaker implantation,8,9,15,15,18,18,20,21,"Isolated , asymptomatic first degree AV block with narrow QRS has not prognostic significance and is not usually treated with pacemaker implantation ."
92393589,end-stage renal disease,are,treated,regular dialysis,7,9,14,14,15,15,17,18,"Vascular calcification is common in patients with end-stage renal disease ( ESRD ) who are treated with regular dialysis , and it may contribute to the very high mortality rate from cardiovascular causes in such patients ."
92543203,deficit,are,treated,central nervous system stimulants,3,3,9,9,11,11,13,16,"Children with attention deficit hyperactivity disorder ( ADHD ) are often treated with central nervous system stimulants , making the evaluation of medication effects an important topic for applied behavior analysts ."
92655952,a unipolar depression,are,treated,a bitemporal electrode placement,2,4,11,11,12,12,14,17,"Patients with a unipolar depression , with psychotic features , who are treated with a bitemporal electrode placement , have a higher likelihood of not completing a pre-ECT cognitive assessment ."
92655952,psychotic features,are,treated,a bitemporal electrode placement,7,8,11,11,12,12,14,17,"Patients with a unipolar depression , with psychotic features , who are treated with a bitemporal electrode placement , have a higher likelihood of not completing a pre-ECT cognitive assessment ."
92657519,aponeurotic blepharoptosis,are,treated,external levator advancement,2,3,5,5,6,6,8,10,Patients with aponeurotic blepharoptosis who are treated with external levator advancement may experience complications such as upper eyelid height asymmetry and often require revision surgery .
93052471,acute heart failure,are,treated,supplemental oxygen,3,5,9,9,10,10,12,13,Most patients with acute heart failure ( AHF ) are treated with supplemental oxygen during hospitalization .
93151863,lumbar hypo-lordosis,is,treated,long-segment fusion,5,6,15,15,17,17,19,20,Purpose Global sagittal imbalance with lumbar hypo-lordosis leads to various problems in elderly populations and is often treated with long-segment fusion and osteotomy .
93151863,lumbar hypo-lordosis,is,treated,osteotomy,5,6,15,15,17,17,22,22,Purpose Global sagittal imbalance with lumbar hypo-lordosis leads to various problems in elderly populations and is often treated with long-segment fusion and osteotomy .
93179751,toxin-negative Clostridioides difficile-positive diarrhea,are,treated,oral vancomycin,2,5,6,6,8,8,10,11,Patients with toxin-negative Clostridioides difficile-positive diarrhea are often treated with oral vancomycin with the assumption that treatment is more beneficial than harmful .
93179751,toxin-negative Clostridioides difficile-positive diarrhea,are,treated,the assumption,2,5,6,6,8,8,13,14,Patients with toxin-negative Clostridioides difficile-positive diarrhea are often treated with oral vancomycin with the assumption that treatment is more beneficial than harmful .
93453922,colorectal cancer,are,treated,bevacizumab,21,22,24,24,25,25,27,27,"This article reviews the incidence , presentation , pathogenesis , risk factors , and management of GI perforation in patients with colorectal cancer who are treated with bevacizumab ."
93515600,limited sclerotic bone lesions,are,treated,radiation therapy,10,13,14,14,16,16,18,19,"POEMS syndrome lacks a standard treatment , but patients with limited sclerotic bone lesions are typically treated with radiation therapy ."
93564175,sub-massive pulmonary embolism,are,treated,thrombolytic therapy,2,4,11,11,12,12,14,15,Patients with sub-massive pulmonary embolism accompanied by right heart dysfunction who are treated with thrombolytic therapy likely will experience more rapid improvement in RV function and are less likely to progress to hemodynamic decompensation .
93625052,psoriatic arthritis,are,treated,subcutaneous biologic therapies,15,16,20,20,22,22,24,26,"Patients with rheumatoid arthritis ( RA ) , ankylosing spondylitis ( AS ) , and psoriatic arthritis ( PsA ) are frequently treated with subcutaneous biologic therapies when disease progresses or when response to synthetic disease-modifying antirheumatic drugs ( DMARDs ) is inadequate ."
93625052,rheumatoid arthritis,are,treated,subcutaneous biologic therapies,2,3,20,20,22,22,24,26,"Patients with rheumatoid arthritis ( RA ) , ankylosing spondylitis ( AS ) , and psoriatic arthritis ( PsA ) are frequently treated with subcutaneous biologic therapies when disease progresses or when response to synthetic disease-modifying antirheumatic drugs ( DMARDs ) is inadequate ."
93625052,ankylosing spondylitis,are,treated,subcutaneous biologic therapies,8,9,20,20,22,22,24,26,"Patients with rheumatoid arthritis ( RA ) , ankylosing spondylitis ( AS ) , and psoriatic arthritis ( PsA ) are frequently treated with subcutaneous biologic therapies when disease progresses or when response to synthetic disease-modifying antirheumatic drugs ( DMARDs ) is inadequate ."
93993538,chronic phase chronic myeloid leukemia,are,treated,tyrosine kinase inhibitors,14,18,22,22,23,23,25,27,Clonal chromosomal abnormalities in Philadelphia chromosome-negative ( CCA/Ph- ) metaphases emerge as patients with chronic phase chronic myeloid leukemia ( CP-CML ) are treated with tyrosine kinase inhibitors ( TKIs ) .
94005448,early stage disease,are,treated,combined modality strategies,2,4,5,5,6,6,8,10,"Patients with early stage disease are treated with combined modality strategies utilizing abbreviated courses of combination chemotherapy followed by involved-field radiation therapy , while those with advanced stage disease receive a longer course of chemotherapy often without radiation therapy ."
94006647,parastomal varices,are,treated,local measures,16,17,18,18,20,20,22,23,Although TIPS has gained popularity over the last two decades almost three quarters of patients with parastomal varices are still treated with local measures as first-line management .
94040571,preterm labor,are,treated,tocolytics,2,3,7,7,9,9,11,11,"Women with preterm labor and intact membranes are usually treated with tocolytics and corticosteroids , but regimens are varied and all use is off label ."
94040571,preterm labor,are,treated,corticosteroids,2,3,7,7,9,9,13,13,"Women with preterm labor and intact membranes are usually treated with tocolytics and corticosteroids , but regimens are varied and all use is off label ."
94040571,intact membranes,are,treated,tocolytics,5,6,7,7,9,9,11,11,"Women with preterm labor and intact membranes are usually treated with tocolytics and corticosteroids , but regimens are varied and all use is off label ."
94040571,intact membranes,are,treated,corticosteroids,5,6,7,7,9,9,13,13,"Women with preterm labor and intact membranes are usually treated with tocolytics and corticosteroids , but regimens are varied and all use is off label ."
94165991,adrenocortical carcinoma,are,treated,the adrenolytic substance mitotane,6,7,11,11,13,13,15,18,"Following initial surgery , patients with adrenocortical carcinoma ( ACC ) are commonly treated with the adrenolytic substance mitotane in an adjuvant or therapeutic setting ."
94427012,high-risk lower grade gliomas,are,treated,single-agent temozolomide,5,8,12,12,13,13,15,16,"The majority of patients with high-risk lower grade gliomas ( LGG ) are treated with single-agent temozolomide ( TMZ ) and radiotherapy despite three randomized trials showing a striking overall survival benefit with adjuvant procarbazine , lomustine , and vincristine ( PCV ) chemotherapy and radiotherapy ."
94427012,high-risk lower grade gliomas,are,treated,radiotherapy,5,8,12,12,13,13,21,21,"The majority of patients with high-risk lower grade gliomas ( LGG ) are treated with single-agent temozolomide ( TMZ ) and radiotherapy despite three randomized trials showing a striking overall survival benefit with adjuvant procarbazine , lomustine , and vincristine ( PCV ) chemotherapy and radiotherapy ."
94841656,immune-mediated rheumatic diseases,are,treated,immunosuppressors,2,4,8,8,10,10,12,12,Patients with immune-mediated rheumatic diseases ( IMRDs ) are commonly treated with immunosuppressors and prone to infections .
94883933,chronic lymphocytic leukemia,are,treated,alkylating agents,16,18,23,23,24,24,26,27,"Although immunoglobulin V(H ) mutation status ( IgV(H ) MS ) is prognostic in patients with chronic lymphocytic leukemia ( CLL ) who are treated with alkylating agents or single-agent fludarabine , its significance in the era of chemoimmunotherapy is not known ."
94883933,chronic lymphocytic leukemia,are,treated,single-agent fludarabine,16,18,23,23,24,24,29,30,"Although immunoglobulin V(H ) mutation status ( IgV(H ) MS ) is prognostic in patients with chronic lymphocytic leukemia ( CLL ) who are treated with alkylating agents or single-agent fludarabine , its significance in the era of chemoimmunotherapy is not known ."
95012801,chronic hepatitis C,are,treated,a 6-month course of recombinant interferon alfa,27,29,31,31,32,32,34,40,"Sustained normalization of serum transaminase levels , often accompanied by a decrease in or disappearance of viral RNA , occurs in approximately 25 % of patients with chronic hepatitis C who are treated with a 6-month course of recombinant interferon alfa ."
95037760,ischaemic cardiovascular disease,are,treated,lipid-lowering therapy,5,7,10,10,12,12,14,15,Large fractions of individuals with ischaemic cardiovascular disease or diabetes are not treated with lipid-lowering therapy .
95109446,increased intracranial pressure,are,treated,ventricular shunts,4,6,7,7,8,8,10,11,Children with hydrocephalus and increased intracranial pressure are treated with ventricular shunts .
95365219,non-resectable colorectal metastases,are,treated,chemotherapy,2,4,5,5,7,7,9,9,Patients with non-resectable colorectal metastases are currently treated with chemotherapy .
95410490,chlamydial ophthalmia neonatorum,are,treated,erythromycin suspension,2,4,5,5,8,8,10,11,Infants with chlamydial ophthalmia neonatorum are now routinely treated with erythromycin suspension by mouth in addition to chlortetracycline eye ointment .
95632121,advanced disease,are,treated,systemic chemotherapy,2,3,4,4,6,6,8,9,Patients with advanced disease are usually treated with systemic chemotherapy .
95770239,metastatic disease,are,treated,these combinations,5,6,8,8,9,9,11,12,"However , most patients with metastatic disease who are treated with these combinations develop progressive disease and a significant proportion of patients , after receiving anthracycline-containing adjuvant therapy , experience recurrent disease ."
96479742,cerebral stroke,are,treated,the latest advances in medical therapies,3,4,5,5,7,7,9,14,Many patients with cerebral stroke are successively treated with the latest advances in medical therapies .
97010985,unstable angina,are,treated,maximal medical therapy,16,17,19,19,20,20,25,27,Studies have reported that more than 90 % of ischemic episodes are silent in patients with unstable angina who are treated in the CCU with maximal medical therapy .
97254655,progressive AVCD,are,treated,a sense of urgency,4,5,6,6,7,7,9,12,Thus patients with rapidly progressive AVCD are treated with a sense of urgency .
97479765,compromised pregnancies,are,treated,antibiotics,2,3,4,4,5,5,11,11,"Mares with compromised pregnancies are treated with progestins , tocolytics and antibiotics according to clinical signs , ultrasonographic examination and hormonal test ."
97479765,compromised pregnancies,are,treated,progestins,2,3,4,4,5,5,7,7,"Mares with compromised pregnancies are treated with progestins , tocolytics and antibiotics according to clinical signs , ultrasonographic examination and hormonal test ."
97479765,compromised pregnancies,are,treated,tocolytics,2,3,4,4,5,5,9,9,"Mares with compromised pregnancies are treated with progestins , tocolytics and antibiotics according to clinical signs , ultrasonographic examination and hormonal test ."
97657554,large or giant ICA aneurysms,are,treated,endovascular ICA balloon occlusion,6,10,11,11,13,13,15,18,"At our institution , patients with large or giant ICA aneurysms are preferably treated with endovascular ICA balloon occlusion ."
97842274,diffuse large B cell lymphoma,are,treated,CHOP chemotherapy,10,14,19,19,20,20,22,23,BCL-2 protein expression correlates with shorter survival in patients with diffuse large B cell lymphoma ( DLBCL ) who are treated with CHOP chemotherapy .
97957232,respiratory failure,are,treated,noninvasive ventilation,8,9,10,10,12,12,14,15,Patients with do-not-intubate ( DNI ) status and respiratory failure are commonly treated with noninvasive ventilation ( NIV ) .
98151733,subclinical hypothyroidism,are,treated,levothyroxine,10,11,12,12,13,13,15,15,There is no reduction in bone density when women with subclinical hypothyroidism are treated with levothyroxine for a year .
98380933,early-stage squamous cell cancer of the anus,are,treated,combination chemoradiation,5,11,13,13,14,14,16,17,"In conclusion , patients with early-stage squamous cell cancer of the anus who are treated with combination chemoradiation continue to demonstrate better overall survival than those who undergo radiotherapy alone ."
98497040,atrial fibrillation,are,treated,surgical AF correction,6,7,14,14,15,15,17,19,Only 40 % of patients with atrial fibrillation ( AF ) undergoing cardiac surgery are treated with surgical AF correction .
98613157,congestive heart failure,are,treated,a standardized methyldigoxin dose,6,8,9,9,10,10,12,15,23 horses and one donkey with congestive heart failure are treated with a standardized methyldigoxin dose ( 0.0032 mg/kg of body weight ) .
98637762,esophageal achalasia,are,treated,esophagectomy,17,18,20,20,21,21,23,23,"While the outcomes after Heller myotomy have been extensively reported , little is known about patients with esophageal achalasia who are treated with esophagectomy ."
99146705,localized malignant tumors,are,treated,radiation,21,23,24,24,25,25,27,27,"Over the years , radiation therapy has been driven by constant technological advances and approximately 50 % of all patients with localized malignant tumors are treated with radiation at some point in the course of their disease ."
99240575,moderate acute malnutrition,are,treated,lipid-based nutrient supplement,2,4,8,8,9,9,11,13,Children with moderate acute malnutrition ( MAM ) are treated with lipid-based nutrient supplement ( LNS ) or corn-soy blend ( CSB ) .
99240575,moderate acute malnutrition,are,treated,corn-soy blend,2,4,8,8,9,9,18,19,Children with moderate acute malnutrition ( MAM ) are treated with lipid-based nutrient supplement ( LNS ) or corn-soy blend ( CSB ) .
99560167,persistent fever,are,treated,amphotericin B,4,5,6,6,8,8,11,12,Patients with neutropenia and persistent fever are often treated empirically with amphotericin B or liposomal amphotericin B to prevent invasive fungal infections .
99560167,persistent fever,are,treated,liposomal amphotericin B,4,5,6,6,8,8,14,16,Patients with neutropenia and persistent fever are often treated empirically with amphotericin B or liposomal amphotericin B to prevent invasive fungal infections .
99604958,hormone-sensitive early breast cancer,are,treated,adjuvant endocrine therapy,3,6,7,7,9,9,11,13,"Postmenopausal patients with hormone-sensitive early breast cancer are typically treated with adjuvant endocrine therapy , which significantly reduces the risk of recurrence ."
99865409,asymptomatic elevated BP,are,treated,IV antihypertensives,3,5,6,6,8,8,10,11,"Hospitalized patients with asymptomatic elevated BP are commonly treated with IV antihypertensives , despite the lack of evidence ."
100255596,diffuse large B-cell lymphoma,are,treated,rituximab,3,6,10,10,12,12,14,14,"Young patients with diffuse large B-cell lymphoma ( DLBCL ) are variably treated with rituximab combined with cyclophosphamide-doxorubicin-vincristine-prednisone ( R-CHOP ) , CHOP-etoposide ( R-CHOEP ) , and anthracycline-based regimens with the addition of high-dose cytarabine/methotrexate ( R-HDA/M ) ."
100371289,combined CAD,are,treated,statins,3,4,7,7,9,9,11,11,"Many patients with combined CAD and diabetes are not treated with statins , although in this very high-risk group , even moderate-intensity statins result in meaningful reductions in cardiovascular events ."
100425284,advanced/metastatic kidney cancer,are,treated,sorafenib,14,16,18,18,19,19,21,21,"We investigated if total progression-free survival ( PFS ) is improved in patients with advanced/metastatic kidney cancer who are treated with sorafenib and then with sunitinib ( So-Su ) , compared with sunitinib and then sorafenib ( Su-So ) ."
100512010,high-risk neuroblastoma,are,treated,radiotherapy,2,3,4,4,5,5,11,11,"Children with high-risk neuroblastoma are treated with polychemotherapy , surgery , radiotherapy and even autologous stem-cell transplantation ."
100512010,high-risk neuroblastoma,are,treated,autologous stem-cell transplantation,2,3,4,4,5,5,14,16,"Children with high-risk neuroblastoma are treated with polychemotherapy , surgery , radiotherapy and even autologous stem-cell transplantation ."
100512010,high-risk neuroblastoma,are,treated,polychemotherapy,2,3,4,4,5,5,7,7,"Children with high-risk neuroblastoma are treated with polychemotherapy , surgery , radiotherapy and even autologous stem-cell transplantation ."
100512010,high-risk neuroblastoma,are,treated,surgery,2,3,4,4,5,5,9,9,"Children with high-risk neuroblastoma are treated with polychemotherapy , surgery , radiotherapy and even autologous stem-cell transplantation ."
100627949,severe adductor type spasmodic dysphonia,are,treated,repeated injections of botulinum toxin type A,5,9,10,10,11,11,13,19,"Today , most patients with severe adductor type spasmodic dysphonia are treated with repeated injections of botulinum toxin type A ( BTA ) ."
100685822,chronic hepatitis C virus infection,are,treated,interferon alfa,2,6,7,7,9,9,11,12,"Patients with chronic hepatitis C virus infection are commonly treated with interferon alfa ( IFN-alpha ) , but the long-term response rate is poor ."
101404644,severe therapy-refractory immune-mediated inflammatory diseases,are,treated,biologics,2,6,10,10,12,12,14,14,Patients with severe therapy-refractory immune-mediated inflammatory diseases ( IMIDs ) are increasingly treated with biologics .
101466496,its trigonocephalic head shape,is,treated,limited incision strip craniectomy,7,10,12,12,14,14,17,20,"Metopic craniosynostosis ( MCS ) , with its trigonocephalic head shape , is often treated with either limited incision strip craniectomy ( LISC ) followed by helmet orthotic treatment , or open cranial vault reconstruction techniques ( OCVR ) ."
101466496,its trigonocephalic head shape,is,treated,open cranial vault reconstruction techniques,7,10,12,12,14,14,31,35,"Metopic craniosynostosis ( MCS ) , with its trigonocephalic head shape , is often treated with either limited incision strip craniectomy ( LISC ) followed by helmet orthotic treatment , or open cranial vault reconstruction techniques ( OCVR ) ."
101535673,positive ALNs,are,treated,NAC,24,25,29,29,30,30,32,32,The histological examination of SLNs and that of non-SLNs suspicious for metastasis are useful for predicting pathological ALN status in BC patients with clinically positive ALNs at presentation who are treated with NAC .
101619210,chronic respiratory failure,are,treated,assisted ventilation,3,5,6,6,7,7,9,10,"When patients with chronic respiratory failure are treated with assisted ventilation , cardiac function determines their survival ."
101814927,short life expectancies,are,treated,standard chemotherapy,24,26,30,30,32,32,34,35,"The favourable safety profile and the increasing confidence with immune checkpoint inhibitors ( ICIs ) might have boosted their prescription in frail patients with short life expectancies , who usually are not treated with standard chemotherapy ."
