sentence_id,medical,are,treated,treatment,medical_first_index,medical_last_index,are_first_index,are_last_index,treated_first_index,treated_last_index,treatment_first_index,treatment_last_index,sentence_text
266618,metabolic dysfunction of cytochrome P450 2C19,are,treated,long-term dual antiplatelet therapy,11,16,18,18,19,19,21,24,Prasugrel effectively reduces the platelet reactivity units in patients with genetically metabolic dysfunction of cytochrome P450 2C19 who are treated with long-term dual antiplatelet therapy after undergoing drug-eluting stent implantation .
543122,spinal tumors,are,treated,a multidisciplinary approach,3,4,5,5,7,7,9,11,"Because patients with spinal tumors are normally treated with a multidisciplinary approach , emphasis should be placed on the recognition of surgical complications beyond the surgical setting ."
599614,acute myeloid leukemia,are,treated,leukapheresis,2,4,28,28,30,30,32,32,"Patients with acute myeloid leukemia ( AML ) and hyperleukocytosis , defined as an initial white blood cell ( WBC ) count of ≥ 100 × 10(9)/L , are often treated with leukapheresis ."
805917,minimal residual disease,are,treated,abdominopelvic radiation,2,4,5,5,7,7,10,11,"Patients with minimal residual disease are best treated with either abdominopelvic radiation or chemotherapy ; patients with stage IV or bulky stage III disease , with chemotherapy ."
805917,minimal residual disease,are,treated,chemotherapy,2,4,5,5,7,7,13,13,"Patients with minimal residual disease are best treated with either abdominopelvic radiation or chemotherapy ; patients with stage IV or bulky stage III disease , with chemotherapy ."
1044976,multivessel coronary artery disease,is,treated,percutaneous coronary intervention,8,11,12,12,13,13,15,17,Traditionally ST-elevation myocardial infarction ( STEMI ) with multivessel coronary artery disease is treated with percutaneous coronary intervention ( PCI ) to culprit lesion only .
1235628,severe cirrhosis,are,treated,supportive care,7,8,9,9,11,11,13,14,Hepatocellular carcinoma ( HCC ) patients with severe cirrhosis are usually treated with supportive care because of their poor prognosis .
1339017,pulmonary metastasis,is,treated,a regression of pulmonary metastasis,4,5,6,6,7,7,15,19,"A bladder cancer with pulmonary metastasis is treated by chemotherapy ( adriamycin-cis platinum ) with a regression of pulmonary metastasis , then by cystectomy with enterocystoplasty , new courses of chemotherapy , then a pulmonary metastasectomy , histologically completely necrotic ."
1669474,diffuse large B-cell lymphoma,are,treated,standard immunochemotherapy,3,6,10,10,13,13,15,16,"Elderly patients with diffuse large B-cell lymphoma ( DLBCL ) are frequently not treated with standard immunochemotherapy , and this influences survival negatively ."
1674671,life-threatening ventricular arrhythmias,are,treated,a implantable cardioverter-defibrillator,13,15,17,17,18,18,20,22,The myocardial perfusion pattern is an important determinant of outcome in patients with life-threatening ventricular arrhythmias who are treated with a implantable cardioverter-defibrillator .
1846842,an acute cerebrovascular event,are,treated,clopidogrel,2,5,10,10,14,14,16,16,Patients with an acute cerebrovascular event have multiple comorbidities and are therefore relatively frequently treated with clopidogrel .
2096163,overt testicular leukemia,are,treated,"2,400-rad testicular radiation",6,8,10,10,11,11,13,15,"These data indicate that boys with overt testicular leukemia who are treated with 2,400-rad testicular radiation are at risk for Leydig cell dysfunction ."
2190734,various cognitive deficits,are,treated,behavioral therapeutic and computer-supported training programs,4,6,7,7,8,8,10,15,Children and adolescents with various cognitive deficits are treated with behavioral therapeutic and computer-supported training programs .
2304818,cerebral palsy,are,treated,botulinum toxin A,5,6,8,8,9,9,11,13,The proportion of children with cerebral palsy who are treated with botulinum toxin A varies considerably between Norwegian habilitation centres .
2668922,cystic fibrosis,are,treated,antibiotics,2,3,24,24,27,27,29,29,"Patients with cystic fibrosis ( CF ) who experience acute declines in percent predicted FEV1 ( ppFEV1 decreased ≥10 % relative to baseline ) are often not treated with antibiotics for pulmonary exacerbations ( PEx ) , whereas other patients are treated even when they have not experienced a decline in lung function ."
2822164,epithelial ovarian cancer,are,treated,platinum/taxane therapy,2,4,8,8,10,10,12,13,Women with epithelial ovarian cancer ( EOC ) are usually treated with platinum/taxane therapy after cytoreductive surgery but there is considerable inter-individual variation in response .
3075429,ischemic ulceration of the foot,are,treated,primary amputation,2,6,17,17,19,19,21,22,Patients with ischemic ulceration of the foot and no continuous tibial or inframalleolar vessels acceptable for bypass are often treated with primary amputation .
3075429,no continuous tibial or inframalleolar vessels acceptable,are,treated,primary amputation,8,14,17,17,19,19,21,22,Patients with ischemic ulceration of the foot and no continuous tibial or inframalleolar vessels acceptable for bypass are often treated with primary amputation .
3082189,trigeminal neuralgia,are,treated,medications,2,3,13,13,15,15,17,17,Patients with trigeminal neuralgia ( TN ) and multiple sclerosis ( MS ) are often treated with medications or a surgical procedure .
3082189,trigeminal neuralgia,are,treated,a surgical procedure,2,3,13,13,15,15,19,21,Patients with trigeminal neuralgia ( TN ) and multiple sclerosis ( MS ) are often treated with medications or a surgical procedure .
3082189,multiple sclerosis,are,treated,medications,8,9,13,13,15,15,17,17,Patients with trigeminal neuralgia ( TN ) and multiple sclerosis ( MS ) are often treated with medications or a surgical procedure .
3082189,multiple sclerosis,are,treated,a surgical procedure,8,9,13,13,15,15,19,21,Patients with trigeminal neuralgia ( TN ) and multiple sclerosis ( MS ) are often treated with medications or a surgical procedure .
3138029,advanced breast cancer,are,treated,preoperative ( neoadjuvant ) systemic therapy,3,5,6,6,8,8,10,15,Patients with locally advanced breast cancer are frequently treated with preoperative ( neoadjuvant ) systemic therapy to downstage the tumor and improve surgical outcomes .
3154576,cardiovascular disease,is,treated,hyperbaric oxygen therapy,9,10,11,11,12,12,14,16,Care should be taken when a diabetic patient with cardiovascular disease is treated with hyperbaric oxygen therapy .
3255240,advanced stage head and neck squamous cell carcinoma,are,treated,cisplatin-containing chemoradiation protocols,2,9,13,13,15,15,17,19,Patients with advanced stage head and neck squamous cell carcinoma ( HNSCC ) are often treated with cisplatin-containing chemoradiation protocols .
3274914,metastatic disease,are,treated,platinum-based cytotoxic chemotherapy regimens,2,3,4,4,6,6,8,11,Patients with metastatic disease are usually treated with platinum-based cytotoxic chemotherapy regimens similar to those used for small cell carcinoma of the lung .
3559472,diagnosed low-risk ankle fractures,are,treated,an ankle brace,19,22,24,24,25,25,27,29,"There is low-quality evidence of a quicker recovery of self reported function at four weeks in children with clinically diagnosed low-risk ankle fractures who are treated with an ankle brace compared with those treated with a rigid cast , especially a non-removable walking cast ."
3644732,pathogenic Helicobacter species,are,treated,combination therapies,3,5,6,6,8,8,10,11,"Gastrointestinal infections with pathogenic Helicobacter species are commonly treated with combination therapies , which often include amoxicillin ."
3981726,new-onset esophageal symptoms,are,treated,oral systemic antifungal therapy,6,8,9,9,11,11,14,17,"In contrast , HIV-infected patients with new-onset esophageal symptoms are usually treated empirically with oral systemic antifungal therapy given the prevalence of Candida esophagitis ."
4002604,differentiated,are,treated,(131)I therapy,2,2,8,8,9,9,11,12,Patients with differentiated thyroid carcinoma ( DTC ) are treated with (131)I therapy after total thyroidectomy or surgical resection of recurrent tumor .
4013656,small hepatocellular carcinoma,are,treated,hepatic resection,2,4,8,8,10,10,12,13,Patients with small hepatocellular carcinoma ( HCC ) are usually treated with hepatic resection or percutaneous ethanol injection ( PEI ) .
4013656,small hepatocellular carcinoma,are,treated,percutaneous ethanol injection,2,4,8,8,10,10,15,17,Patients with small hepatocellular carcinoma ( HCC ) are usually treated with hepatic resection or percutaneous ethanol injection ( PEI ) .
4029685,metastatic colorectal cancer,are,treated,chemotherapy,8,10,11,11,13,13,15,15,"In fact , many otherwise-healthy older patients with metastatic colorectal cancer are not treated with chemotherapy ."
4258664,upper respiratory infection,are,treated,clarithromycin,2,4,5,5,7,7,11,11,Patients with upper respiratory infection are often treated with theophylline and clarithromycin concurrently .
4258664,upper respiratory infection,are,treated,theophylline,2,4,5,5,7,7,9,9,Patients with upper respiratory infection are often treated with theophylline and clarithromycin concurrently .
4266472,advanced non-small cell lung cancer,are,treated,gemcitabine-platinum,28,32,37,37,38,38,40,40,"This multicenter , non-interventional , prospective , observational study aimed to determine whether patients ' attitude to chemotherapy is an independent prognostic factor for survival in patients with advanced non-small cell lung cancer ( NSCLC ) who are treated with gemcitabine-platinum ."
4357547,excessive flaccidity,are,treated,lipoplasty,14,15,18,18,19,19,21,21,"In patients with mild flaccidity , short incisions are used , but patients with excessive flaccidity with adiposity are treated with lipoplasty and tissue removal involving a long incision to produce the best aesthetic contour ."
4357547,excessive flaccidity,are,treated,tissue removal,14,15,18,18,19,19,23,24,"In patients with mild flaccidity , short incisions are used , but patients with excessive flaccidity with adiposity are treated with lipoplasty and tissue removal involving a long incision to produce the best aesthetic contour ."
4668824,viable myocardium,are,treated,medical therapy,2,3,5,5,6,6,11,12,"Patients with viable myocardium who are treated with revascularization rather than medical therapy have better outcomes in terms of survival , left ventricular function , symptoms , and exercise capacity ."
4668824,viable myocardium,are,treated,revascularization,2,3,5,5,6,6,8,8,"Patients with viable myocardium who are treated with revascularization rather than medical therapy have better outcomes in terms of survival , left ventricular function , symptoms , and exercise capacity ."
4776250,a positive antinuclear antibody test,are,treated,toxic medications,3,7,8,8,17,17,19,20,Many patients with a positive antinuclear antibody test are incorrectly given a diagnosis of SLE and sometimes treated with toxic medications .
4831031,advanced muscle-invasive bladder cancer,are,treated,radical cystectomy,19,22,27,27,28,28,30,31,We purposed to assess the effects of adjuvant chemotherapy ( ACH ) on survival outcomes in patients with locally advanced muscle-invasive bladder cancer ( MIBC ) who are treated with radical cystectomy ( RC ) .
5040981,nephrotic syndrome,are,treated,a course of prednisolone,3,4,9,9,10,10,12,15,"Those patients with nephrotic syndrome especially with selective proteinuria are treated with a course of prednisolone and failing that , cyclophosphamide ."
5072049,exposed,are,treated,0.5 M KCl,3,3,5,5,6,6,8,10,"When axonemes with exposed doublets are treated with 0.5 M KCl for 30 min , the compact arms and the dynein heavy (H)-chains disappear , while isolated bouquets and dynein H-chains appear in the medium , suggesting that the compact arms give rise to the bouquets as they are solubilized ."
5118740,profound biotinidase deficiency,are,treated,biotin,3,5,6,6,7,7,9,9,"The infants with profound biotinidase deficiency are treated with biotin ( 2 x 5 mg/day ) from the 3rd , 6th and 8th week of life and have developed normally so far ."
5149264,recurrent prostate cancer,are,treated,androgen withdrawal therapy,2,4,5,5,7,7,9,11,"Patients with recurrent prostate cancer are commonly treated with androgen withdrawal therapy ( AWT ) ; however , almost all patients eventually progress to castration resistant prostate cancer ( CRPC ) , indicating failure of AWT to eliminate androgen-sensitive prostate cancer ."
5215113,preexisting,are,treated,total hip replacement,2,2,6,6,7,7,9,11,Patients with preexisting hip disease also are treated with total hip replacement .
5283344,hilar biliary obstruction,are,treated,internal-external biliary drainage catheters,2,4,5,5,7,7,9,12,Patients with hilar biliary obstruction are better treated with internal-external biliary drainage catheters .
5305236,auditory neuropathy,are,treated,cochlear implantation,22,23,29,29,31,31,33,34,"The possibility of using the auditory brainstem implant as first-choice therapy in some categories of deaf patients ( e.g. , subjects with auditory neuropathy or cochlear ossification ) who are currently treated with cochlear implantation is discussed ."
5305236,cochlear ossification,are,treated,cochlear implantation,25,26,29,29,31,31,33,34,"The possibility of using the auditory brainstem implant as first-choice therapy in some categories of deaf patients ( e.g. , subjects with auditory neuropathy or cochlear ossification ) who are currently treated with cochlear implantation is discussed ."
5396664,pulmonary embolism,are,treated,low molecular weight heparin,4,5,9,9,11,11,16,19,"Traditionally , patients with pulmonary embolism ( PE ) are initially treated in the hospital with low molecular weight heparin ( LMWH ) ."
5467630,ascending aortic involvement,are,treated,surgical repair,5,7,8,8,9,9,11,12,"While most TAA cases with ascending aortic involvement are treated with surgical repair ( primarily valve-preserving techniques ) , aneurysms of the distal arch and descending thoracic aorta are amenable to alternatives to classic open repair such as the emerging endovascular treatment techniques ."
5796465,non-Hodgkin lymphoma,are,treated,a cocktail of drugs,2,3,7,7,8,8,11,14,"Patients with non-Hodgkin lymphoma ( NHL ) are treated today with a cocktail of drugs referred to as CHOP ( Cyclophosphamide , Hydroxyldaunorubicin , Oncovin , and Prednisone ) ."
5900612,mild GO,are,treated,local measures,5,6,7,7,9,9,12,13,"In contrast , patients with mild GO are generally treated only with local measures ."
6089428,tears greater,are,treated,subacromial decompression,10,11,15,15,16,16,18,19,Low demand patients with 0 to 5 cm tears or tears greater than 5 cm are treated with subacromial decompression and rotator cuff debridement .
6089428,tears greater,are,treated,rotator cuff debridement,10,11,15,15,16,16,21,23,Low demand patients with 0 to 5 cm tears or tears greater than 5 cm are treated with subacromial decompression and rotator cuff debridement .
6150987,acute lymphoblastic leukemia,are,treated,oral 6-mercaptopurine,3,5,9,9,10,10,12,13,"Pediatric patients with acute lymphoblastic leukemia ( ALL ) are treated with oral 6-mercaptopurine ( 6MP ) for nearly 2 years , but no pediatric formulation has been available ."
6175631,ischemic stroke,are,treated,long-term oral anticoagulation,2,3,10,10,11,11,13,15,Patients with ischemic stroke and atrial fibrillation ( AF ) are treated with long-term oral anticoagulation ( OAC ) because it is considerably more effective than antiplatelet ( AP ) therapy for the prevention of subsequent strokes and systemic emboli .
6175631,atrial fibrillation,are,treated,long-term oral anticoagulation,5,6,10,10,11,11,13,15,Patients with ischemic stroke and atrial fibrillation ( AF ) are treated with long-term oral anticoagulation ( OAC ) because it is considerably more effective than antiplatelet ( AP ) therapy for the prevention of subsequent strokes and systemic emboli .
6182826,symptomatic malignant pleural effusion,are,treated,large-bore chest tube placement,2,5,6,6,8,8,10,13,Patients with symptomatic malignant pleural effusion are usually treated with large-bore chest tube placement and pleurodesis requiring > or = 3 days of hospitalization .
6182826,symptomatic malignant pleural effusion,are,treated,pleurodesis,2,5,6,6,8,8,15,15,Patients with symptomatic malignant pleural effusion are usually treated with large-bore chest tube placement and pleurodesis requiring > or = 3 days of hospitalization .
6194701,rheumatoid arthritis,are,treated,slow-acting anti-rheumatic drugs,9,10,14,14,15,15,17,19,Rheumatologists usually recommend monthly blood monitoring when patients with rheumatoid arthritis ( RA ) are treated with slow-acting anti-rheumatic drugs ( SAARDs ) .
6371156,chronic viral hepatitis C,are,treated,pegylated interferon-ribavirin therapy,6,9,10,10,11,11,13,15,The great majority of patients with chronic viral hepatitis C are treated with pegylated interferon-ribavirin therapy .
6462775,bacillus Calmette-Guérin-unresponsive carcinoma,are,treated,radical cystectomy,2,4,7,7,8,8,10,11,Patients with bacillus Calmette-Guérin-unresponsive carcinoma in situ are treated with radical cystectomy or salvage intravesical chemotherapy .
6462775,bacillus Calmette-Guérin-unresponsive carcinoma,are,treated,salvage intravesical chemotherapy,2,4,7,7,8,8,13,15,Patients with bacillus Calmette-Guérin-unresponsive carcinoma in situ are treated with radical cystectomy or salvage intravesical chemotherapy .
6462775,in,are,treated,radical cystectomy,5,5,7,7,8,8,10,11,Patients with bacillus Calmette-Guérin-unresponsive carcinoma in situ are treated with radical cystectomy or salvage intravesical chemotherapy .
6462775,in,are,treated,salvage intravesical chemotherapy,5,5,7,7,8,8,13,15,Patients with bacillus Calmette-Guérin-unresponsive carcinoma in situ are treated with radical cystectomy or salvage intravesical chemotherapy .
7212505,inflammatory breast carcinoma,are,treated,anthracyclines,12,14,16,16,17,17,19,19,The rates of ALN pCR are nearly 50 % in patients with inflammatory breast carcinoma who are treated with anthracyclines and weekly paclitaxel before surgery .
7212505,inflammatory breast carcinoma,are,treated,weekly paclitaxel,12,14,16,16,17,17,21,22,The rates of ALN pCR are nearly 50 % in patients with inflammatory breast carcinoma who are treated with anthracyclines and weekly paclitaxel before surgery .
7353568,multicentric T-cell lymphoma,are,treated,CHOP chemotherapy protocols,2,4,5,5,7,7,9,11,"Dogs with multicentric T-cell lymphoma are commonly treated with CHOP chemotherapy protocols that include cyclophosphamide , doxorubicin , vincristine and prednisone ."
7455733,ST-segment elevation myocardial infarction,are,treated,primary percutaneous coronary intervention,12,15,20,20,21,21,23,26,The effect of oral beta-blocker therapy on long-term mortality in patients with ST-segment elevation myocardial infarction ( STEMI ) who are treated with primary percutaneous coronary intervention ( PCI ) and who have preserved left ventricular ejection fraction ( LVEF ) remains unclear .
7487593,low-grade gliomas,are,treated,gross total resection,8,9,10,10,12,12,14,16,"In the author 's experience , patients with low-grade gliomas are best treated with gross total resection in order to decrease the risk of recurrence with higher grade lesions ."
7707797,malignant diseases,are,treated,granulocyte-colony stimulating factor,2,3,4,4,5,5,7,9,Patients with malignant diseases are treated with granulocyte-colony stimulating factor ( G-CSF ) for the recovery of granulocytes after chemotherapy or hematopoietic cell ( HC ) transplantation .
7772736,multiple macular lesions,are,treated,the MB-MDT regimen,2,4,10,10,12,12,14,16,Patients with multiple macular lesions and those with neuritic leprosy are best treated with the MB-MDT regimen .
7772736,neuritic leprosy,are,treated,the MB-MDT regimen,8,9,10,10,12,12,14,16,Patients with multiple macular lesions and those with neuritic leprosy are best treated with the MB-MDT regimen .
7882327,cervical radiculopathy,are,treated,anterior cervical discectomy,2,3,6,6,8,8,10,12,Patients with cervical radiculopathy and/or myelopathy are often treated with anterior cervical discectomy and fusion .
7882327,cervical radiculopathy,are,treated,fusion,2,3,6,6,8,8,14,14,Patients with cervical radiculopathy and/or myelopathy are often treated with anterior cervical discectomy and fusion .
8019725,acute lymphoblastic leukaemia,are,treated,intrathecal chemotherapy,9,11,15,15,18,18,20,21,To reduce the risk of brain damage children with acute lymphoblastic leukaemia ( ALL ) are nowadays mainly treated with intrathecal chemotherapy ( ITC ) instead of central nervous system ( CNS ) radiation therapy ( CRT ) to prevent CNS relapse .
8019725,acute lymphoblastic leukaemia,are,treated,central nervous system ( CNS ) radiation therapy,9,11,15,15,18,18,27,34,To reduce the risk of brain damage children with acute lymphoblastic leukaemia ( ALL ) are nowadays mainly treated with intrathecal chemotherapy ( ITC ) instead of central nervous system ( CNS ) radiation therapy ( CRT ) to prevent CNS relapse .
8179555,advanced epithelial ovarian cancer,are,treated,platinum-paclitaxel chemotherapy,2,5,6,6,8,8,10,11,"Women with advanced epithelial ovarian cancer are routinely treated with platinum-paclitaxel chemotherapy following cytoreductive surgery , yet only approximately 20 % achieve long-term disease-free survival ."
8351141,severe angular and rotation changes,are,treated,fusions,22,26,27,27,29,29,31,31,"Debridement of degenerative distal interphalangeal joints with mild to moderate disease can provide satisfactory outcomes ; however , those joints with more severe angular and rotation changes are reliably treated with fusions ."
8354925,metastatic melanoma,are,treated,the combination of dacarbazine,24,25,26,26,27,27,29,32,"Numerous articles have reported an overall response rate of 47 % ( 95 % confidence limit , 39.25 to 54.75 ) when patients with metastatic melanoma are treated with the combination of dacarbazine ( DTIC ) , carmustine ( BCNU ) , cisplatin ( DDP ) , and TAM ( DBDT ) ."
8625423,well-differentiated liposarcomas ( WDLPS ) of the extremity,are,treated,surgical resection,2,9,12,12,13,13,16,17,"Patients with well-differentiated liposarcomas ( WDLPS ) of the extremity and trunk are treated primarily with surgical resection , with radiation used for a number of anecdotal reasons , including large size and positive margins ."
8949719,limited neurologic disability,are,treated,chemotherapy,13,15,16,16,17,17,19,19,"As a consequence , all physiological young patients with good performance status or limited neurologic disability are treated with chemotherapy ."
8949719,good performance status,are,treated,chemotherapy,9,11,16,16,17,17,19,19,"As a consequence , all physiological young patients with good performance status or limited neurologic disability are treated with chemotherapy ."
9217224,acute STEMI,are,treated,primary percutaneous coronary intervention,17,18,20,20,21,21,23,26,To evaluate the value of admission MPV and WBC count in predicting impaired reperfusion in patients with acute STEMI who are treated with primary percutaneous coronary intervention ( PCI ) .
9602165,inflammatory bowel disease,are,treated,immune-modulating medications,2,4,12,12,13,13,15,16,Patients with inflammatory bowel disease ( IBD ) have intestinal inflammation and are treated with immune-modulating medications .
9678774,multiple myeloma,are,treated,the anti-CD38 therapeutic monoclonal antibody,2,3,15,15,16,16,18,22,"Patients with multiple myeloma ( MM ) who are relapsed or refractory to standard treatment are treated with the anti-CD38 therapeutic monoclonal antibody , Daratumumab ."
10262919,progressive disease,are,treated,mitotane,2,3,4,4,6,6,8,8,"Patients with progressive disease are frequently treated with mitotane , alone or in combination with etoposide , doxorubicine and cisplatin ."
10277252,localized prostate cancer,are,treated,external radiotherapy,3,5,7,7,8,8,10,11,Purpose Men with localized prostate cancer often are treated with external radiotherapy ( RT ) over 8 to 9 weeks .
10437517,advanced head and neck squamous cell carcinomas,are,treated,concomitant chemotherapy,2,8,12,12,14,14,16,17,"Patients with advanced head and neck squamous cell carcinomas ( HNSCCs ) are often treated with concomitant chemotherapy and radiotherapy , but only 50 % is cured ."
10437517,advanced head and neck squamous cell carcinomas,are,treated,radiotherapy,2,8,12,12,14,14,19,19,"Patients with advanced head and neck squamous cell carcinomas ( HNSCCs ) are often treated with concomitant chemotherapy and radiotherapy , but only 50 % is cured ."
10746640,acid-related symptoms,are,treated,a standard dose of proton pump inhibitors,2,3,7,7,9,9,12,18,Patients with acid-related symptoms in general practice are often treated empirically with a standard dose of proton pump inhibitors ( PPIs ) .
10796890,stable angina,are,treated,combinations of these drugs,2,3,18,18,20,20,22,25,"Patients with stable angina not controlled by monotherapy with nitrates , beta blockers , or calcium channel blockers are often treated with combinations of these drugs ."
11038524,exocrine pancreatic insufficiency,are,treated,porcine pancreatic enzymes,2,4,5,5,7,7,9,11,Patients with exocrine pancreatic insufficiency are usually treated with porcine pancreatic enzymes but the bioavailability of these enzymes in the gut remains a matter of discussion .
