sentence_id,medical,are,treated,treatment,medical_first_index,medical_last_index,are_first_index,are_last_index,treated_first_index,treated_last_index,treatment_first_index,treatment_last_index,sentence_text
270614725,different properties,are,treated,the appropriate reagent solutions,3,4,5,5,9,9,11,14,"Silk yarns with different properties are first selected , treated with the appropriate reagent solutions , dried and handloom-woven in one step into an integrated fabric chip ."
270645877,follicular lymphomas,are,treated,radiation therapy,2,3,8,8,9,9,11,12,"Patients with follicular lymphomas with early-stage disease generally are treated with radiation therapy , whereas those with stage III and IV disease requiring treatment usually are treated with chemotherapy , Immunotherapy , or radioimmunotherapy ."
270645880,extensive disease,are,treated,rituximab,2,3,4,4,5,5,7,7,Those with extensive disease are treated with rituximab combined with chemotherapy alone .
270898378,severe periodontitis,are,treated,immediate zygomatic implant surgery,16,17,19,19,20,20,22,25,Comprehensive nursing intervention during perioperative period is necessary and deserves to be applied for patients with severe periodontitis who are treated with immediate zygomatic implant surgery .
270978361,early stage disease,are,treated,combined modality strategies,2,4,5,5,7,7,9,11,"Patients with early stage disease are typically treated with combined modality strategies utilizing abbreviated courses of combination chemotherapy , followed by involved-field radiation therapy ."
271682208,thoracic esophageal cancer,are,treated,preoperative radiotherapy,6,8,10,10,11,11,13,14,Our findings suggest that patients with thoracic esophageal cancer who are treated with preoperative radiotherapy must be carefully monitored for the occurrence of intramural lymphatic cancer invasion and distant lymph node metastasis .
271708763,a reverse Hill-Sachs impaction fracture,are,treated,lesser tuberosity transfer,5,9,19,19,22,22,24,26,"Locked posterior glenohumeral dislocations with a reverse Hill-Sachs impaction fracture involving less than 30 % of the humeral head are most frequently treated with lesser tuberosity transfer into the defect , whereas those involving more than 50 % undergo humeral head arthroplasty ."
271831472,severe abdominal pain,are,treated,low-dose steroids,6,8,9,9,10,10,12,13,Most cases of Henoch-Schönlein purpura with severe abdominal pain are treated with low-dose steroids and intravenous immunoglobulin .
271831472,severe abdominal pain,are,treated,intravenous immunoglobulin,6,8,9,9,10,10,15,16,Most cases of Henoch-Schönlein purpura with severe abdominal pain are treated with low-dose steroids and intravenous immunoglobulin .
271870189,pancreatic cancer,are,treated,neoadjuvant therapy,12,13,15,15,16,16,18,19,These data provide evidence against higher postoperative complication rates in patients with pancreatic cancer who are treated with neoadjuvant therapy .
271895520,inflammatory bowel disease,are,treated,biologic therapy,2,4,5,5,7,7,11,12,Patients with inflammatory bowel disease are commonly treated with immunomodulators and biologic therapy .
271895520,inflammatory bowel disease,are,treated,immunomodulators,2,4,5,5,7,7,9,9,Patients with inflammatory bowel disease are commonly treated with immunomodulators and biologic therapy .
272156645,fibromuscular dysplasia,are,treated,balloon angioplasty,19,20,21,21,23,23,25,26,"When revascularization is deemed appropriate , atherosclerotic RAS is most often treated with stent placement , whereas patients with fibromuscular dysplasia are usually treated with balloon angioplasty ."
272497367,extensive involvement,are,treated,synovectomy,12,13,15,15,16,16,18,18,"Our results also indicated that synovial osteochondromatosis may recur in patients with extensive involvement who are treated with synovectomy alone without dislocation of the hip ; however , surgical complications are more likely to occur in patients managed with anterior dislocation of the hip and synovectomy ."
272651965,chronic kidney disease,are,treated,erythropoiesis-stimulating agents,17,19,30,30,31,31,33,34,"Clinical trials demonstrate either no benefit or increased risk of cardiovascular events and mortality in patients with chronic kidney disease ( CKD ) targeted for higher hemoglobin levels , who are treated with erythropoiesis-stimulating agents ( ESAs ) ."
272659659,chronic lymphocytic leukemia,are,treated,chlorambucil,3,5,13,13,15,15,17,17,Elderly patients with chronic lymphocytic leukemia ( CLL ) or patients with comorbidities are often treated with chlorambucil ( Chl ) as front-line therapy despite relatively low response rates .
273016233,severe male factor infertility,are,treated,assisted reproduction technology,3,6,7,7,8,8,10,12,Most couples with severe male factor infertility are treated with assisted reproduction technology and little has been known about the prognosis of severe male factor infertility itself .
273638983,severe GHD,are,treated,lower GH starting doses,5,6,30,30,31,31,33,36,"Recently , patients with less severe GHD ( mean IGF-I SDS : -2.1 , -1.6 , -1.0 in the 1st , 2nd and 3rd interval ; p = 0.000 ) are treated with lower GH starting doses ( mean 0.30 , 0.19 , 0.21 mg/day in the 1st , 2nd and 3rd interval ; p = 0.000 ) ."
273682051,results similar,is,treated,LC,36,37,29,29,31,31,33,33,"The syndrome consisting of chronic biliary symptoms , stone-free sonograms , low EF in CCK-HIDA , and absence of other pain sources is highly predictive for CAC , which is well treated with LC , with results similar to those for calculous disease ."
274265077,T1 N0 rectal cancer,are,treated,local excision,3,6,7,7,9,9,11,12,Selected patients with T1 N0 rectal cancer are best treated with local excision by transanal endoscopic microsurgery ( TEM ) .
274310492,chronic renal failure,are,treated,hemodialysis,11,13,15,15,16,16,18,18,Cardiovascular events are the main cause of death in patients with chronic renal failure who are treated with hemodialysis .
274509362,active hemorrhage,are,treated,heparin-free hemodialysis,6,7,15,15,17,17,19,20,"In general , hemodialysis patients with active hemorrhage or at high risk for bleeding complications are best treated with heparin-free hemodialysis ."
274515908,peri-implant defects,are,treated,GBR,6,7,9,9,10,10,12,12,This study demonstrates that implants with peri-implant defects that are treated with GBR had similar survival rates and crestal bone levels compared with implants in native bone .
274687276,acute left-sided malignant colonic obstruction,are,treated,emergency surgery,4,8,9,9,10,10,12,13,"Conventionally , patients with acute left-sided malignant colonic obstruction are treated with emergency surgery to restore luminal patency ."
274688822,developmental enamel defects,are,treated,stainless steel crowns,4,6,8,8,9,9,11,13,Young permanent molars with developmental enamel defects commonly are treated with stainless steel crowns .
274913241,primary systemic ( AL ) amyloidosis,are,treated,cyclic dexamethasone ( DXM ) courses,2,7,11,11,13,13,15,20,Patients with primary systemic ( AL ) amyloidosis or multiple myeloma are frequently treated with cyclic dexamethasone ( DXM ) courses and often require oral anticoagulants .
274913241,multiple myeloma,are,treated,cyclic dexamethasone ( DXM ) courses,9,10,11,11,13,13,15,20,Patients with primary systemic ( AL ) amyloidosis or multiple myeloma are frequently treated with cyclic dexamethasone ( DXM ) courses and often require oral anticoagulants .
274951704,refractory fecal incontinence,are,treated,percutaneous tibial nerve stimulation,6,8,9,9,11,11,13,16,"In our institution , patients with refractory fecal incontinence are generally treated with percutaneous tibial nerve stimulation before being considered for sacral nerve stimulation ."
275465724,defined,are,treated,ultrasonic waves,14,14,17,17,18,18,20,21,In order to desintegrate the membranes and to isolate Rh antigens erythrocytes with well defined Rh patterns are treated with ultrasonic waves .
275542379,acute lumbar disc prolapse,are,treated,physiotherapy,2,5,15,15,17,17,19,19,Patients with acute lumbar disc prolapse with sciatica who are not considered candidates for surgery are usually treated with physiotherapy and non-steroidal anti-inflammatory agents .
275542379,acute lumbar disc prolapse,are,treated,non-steroidal anti-inflammatory agents,2,5,15,15,17,17,21,23,Patients with acute lumbar disc prolapse with sciatica who are not considered candidates for surgery are usually treated with physiotherapy and non-steroidal anti-inflammatory agents .
275727560,end-stage renal disease,are,treated,renal replacement therapy,2,4,8,8,9,9,11,13,"Patients with end-stage renal disease ( ESRD ) are treated with renal replacement therapy , including dialysis or organ transplantation ."
275754197,unresectable pulmonary metastases,are,treated,systemic chemotherapy,2,4,15,15,17,17,19,20,Patients with unresectable pulmonary metastases or extrapulmonary metastatic sarcoma have a uniformly poor prognosis and are best treated with systemic chemotherapy .
275754197,extrapulmonary metastatic sarcoma,are,treated,systemic chemotherapy,6,8,15,15,17,17,19,20,Patients with unresectable pulmonary metastases or extrapulmonary metastatic sarcoma have a uniformly poor prognosis and are best treated with systemic chemotherapy .
275887314,low birth weight,are,treated,antibiotics,7,9,10,10,11,11,14,14,"Currently , most preterm infants with very low birth weight are treated empirically with antibiotics for risk of EOS , often for prolonged periods , in the absence of a culture-confirmed infection ."
276198110,familial hypercholesterolemia,are,treated,high-dose atorvastatin,8,9,10,10,12,12,14,15,"Therefore , both placebo- and statin-treated patients with familial hypercholesterolemia are best treated with high-dose atorvastatin , a therapeutic regimen that induces atherosclerosis regression and is safe and well tolerated over a 4-year period ."
276555161,inflammatory eye disease,Are,treated,systemic immunosuppressive therapy,3,5,0,0,6,6,8,10,Are patients with inflammatory eye disease treated with systemic immunosuppressive therapy at increased risk of malignancy ?
276983469,chronic intestinal failure,are,treated,parenteral nutrition,2,4,5,5,6,6,9,10,"Patients with chronic intestinal failure are treated primarily with parenteral nutrition , often for many years ."
277066986,classic congenital adrenal hyperplasia,are,treated,lifelong glucocorticoids,2,5,9,9,10,10,12,13,PATIENTS with classic congenital adrenal hyperplasia ( CAH ) are treated with lifelong glucocorticoids ( GCs ) .
277257528,recent ACS,are,treated,statins,3,4,6,6,7,7,9,9,"For patients with recent ACS who are treated with statins , Lp(a ) concentration was not associated with adverse cardiovascular outcomes ."
277561921,AIDS-related KS,are,treated,a DOX-SL regimen,2,3,4,4,5,5,7,9,Patients with AIDS-related KS are treated with a DOX-SL regimen every 2 - 3 weeks and are followed carefully for evidence of adverse treatment effects .
277863469,high likelihood of organ-confined disease,are,treated,brachytherapy,2,6,7,7,8,8,10,10,"Patients with high likelihood of organ-confined disease are treated with brachytherapy only , whereas those with more advanced disease are treated with brachytherapy in conjunction with EBRT and/or hormonal manipulation ."
277892993,ischemic heart disease,are,treated,beta-adrenoceptor antagonists,4,6,7,7,9,9,11,12,"Patients with hypertension or ischemic heart disease are often treated with beta-adrenoceptor antagonists , yet the degree of beta-adrenoceptor blockade has rarely been studied in relation to anesthesia ."
277910855,such seizures,are,treated,antiepileptic drugs,3,4,11,11,13,13,15,16,"Many patients with such seizures are misdiagnosed with epilepsy , and are consequently treated with antiepileptic drugs for many years ."
278035428,complete response to HCC therapy,are,treated,DAAs,7,11,13,13,14,14,16,16,"BEST PRACTICE ADVICE 12 : Patients with complete response to HCC therapy who are treated with DAAs have a continued risk of HCC recurrence and require HCC surveillance , which should be conducted indefinitely with dynamic contrast-enhanced computed tomography or magnetic resonance imaging every 3 - 6 months ."
278096914,diabetic retinopathy,are,treated,anti-vascular endothelial growth factor ( VEGF ) therapy,5,6,8,8,9,9,12,19,To illustrate that patients with diabetic retinopathy who are treated exclusively with anti-vascular endothelial growth factor ( VEGF ) therapy and have an interruption in treatment may experience marked progression of disease with potentially devastating visual consequences .
278098014,metastatic prostate cancer,are,treated,LHRH analogue,4,6,7,7,9,9,11,12,"However , patients with metastatic prostate cancer are usually treated with LHRH analogue ."
278208421,uncomplicated viral upper respiratory tract infections,are,treated,antimicrobials,8,13,15,15,16,16,18,18,This will minimize the number of children with uncomplicated viral upper respiratory tract infections who are treated with antimicrobials .
278258638,extensive disease,are,treated,androgen ablation,3,4,5,5,6,6,13,14,Those with locally extensive disease are treated with external beam irradiation or with androgen ablation .
278258638,extensive disease,are,treated,external beam irradiation,3,4,5,5,6,6,8,10,Those with locally extensive disease are treated with external beam irradiation or with androgen ablation .
278366614,BRAF-mutant metastatic melanoma,are,treated,dabrafenib,12,14,16,16,17,17,19,19,"Despite rapid and significant tumor reduction in a majority of patients with BRAF-mutant metastatic melanoma who are treated with dabrafenib , this drug 's use as a single agent is limited because of its relatively short duration of response ."
278808262,bulky N2 disease,are,treated,combined chemoradiotherapy,2,4,5,5,7,7,9,10,Patients with bulky N2 disease are mostly treated with combined chemoradiotherapy although the precise treatment scheme has not been determined yet .
278990974,disseminated CMV infection,are,treated,ganciclovir,11,13,15,15,17,17,19,19,The repletion of body cell mass observed in AIDS patients with disseminated CMV infection who are successfully treated with ganciclovir appears to be associated with improved quality of life and prolongation of survival .
279002531,patent ductus arteriosus,are,treated,ibuprofen,4,6,7,7,8,8,10,10,"Prematurely born children with patent ductus arteriosus are treated with ibuprofen or indomethacin , which may inhibit kidney development ."
279002531,patent ductus arteriosus,are,treated,indomethacin,4,6,7,7,8,8,12,12,"Prematurely born children with patent ductus arteriosus are treated with ibuprofen or indomethacin , which may inhibit kidney development ."
279296462,valvular heart disease,are,treated,a transcatheter aortic valve implantation,23,25,27,27,28,28,30,34,"The TAVI Care & Cure program will facilitate prognostic contributions to improve outcomes , patient satisfaction and quality of life in patients with valvular heart disease who are treated with a transcatheter aortic valve implantation in collaboration with the departments of cardiology , cardio-thoracic surgery , anesthesiology and geriatrics ."
279464459,acute psychiatric disorders,are,treated,long-term clinical admission,2,4,5,5,7,7,9,11,Adolescents with acute psychiatric disorders are typically treated with long-term clinical admission .
279529373,FIGO stage III epithelial ovarian cancer,are,treated,primary cytoreductive surgery,16,21,23,23,24,24,26,28,"The primary objective is to evaluate the effect of HIPEC on overall survival in patients with FIGO stage III epithelial ovarian cancer who are treated with primary cytoreductive surgery resulting in no residual disease , or residual disease up to 2.5"
279720260,advanced kidney disease,are,treated,insulin,7,9,10,10,12,12,14,14,Patients with type 2 diabetes mellitus and advanced kidney disease are usually treated with insulin .
279784939,acute ischemic stroke,are,treated,intravenous thrombolysis,15,17,18,18,19,19,21,22,The American Heart Association estimates that only 3 % to 5 % of patients with acute ischemic stroke are treated with intravenous thrombolysis .
280403317,fusion-positive ARMS,are,treated,an aggressive therapeutic regimen,3,4,13,13,14,14,16,19,"Since patients with fusion-positive ARMS ( FP-RMS ) have a poor prognosis and are treated with an aggressive therapeutic regimen , correct classification is of clinical importance ."
280559559,Ullrich-Turner syndrome,are,treated,growth hormone,2,3,7,7,8,8,11,12,Patients with Ullrich-Turner syndrome ( UTS ) are treated increasingly with growth hormone ( GH ) to improve growth velocity and final height .
280956395,patellar instability,are,treated,the docking technique,2,3,5,5,6,6,8,10,"Patients with patellar instability who are treated with the docking technique for MPFL reconstruction will have improvements in knee symptoms and function , with a high percentage achieving good to excellent results at early follow-up ."
280996050,infected arthroplasties,are,treated,a two-stage exchange procedure,2,3,4,4,6,6,8,11,Patients with infected arthroplasties are normally treated with a two-stage exchange procedure using polymethylmethacrylate bone cement spacers impregnated with antibiotics .
281175788,enteric fever,are,treated,beta-lactam antibiotics,2,3,8,8,10,10,12,13,"Children with enteric fever or severe salmonella infections are usually treated with beta-lactam antibiotics , particularly ceftriaxone ."
281175788,severe salmonella infections,are,treated,beta-lactam antibiotics,5,7,8,8,10,10,12,13,"Children with enteric fever or severe salmonella infections are usually treated with beta-lactam antibiotics , particularly ceftriaxone ."
281267478,colorectal peritoneal metastases,are,treated,hyperthermic intraperitoneal chemotherapy,3,5,6,6,7,7,15,17,Selected patients with colorectal peritoneal metastases are treated with cytoreductive surgery ( CRS ) and hyperthermic intraperitoneal chemotherapy ( HIPEC ) .
281267478,colorectal peritoneal metastases,are,treated,cytoreductive surgery,3,5,6,6,7,7,9,10,Selected patients with colorectal peritoneal metastases are treated with cytoreductive surgery ( CRS ) and hyperthermic intraperitoneal chemotherapy ( HIPEC ) .
281309929,resectable colorectal liver metastases,are,treated,percutaneous radiofrequency,3,6,10,10,11,11,13,14,"When patients with resectable colorectal liver metastases ( LM ) are treated with percutaneous radiofrequency ( RF ) , some unsuspected intrahepatic and extrahepatic metastases , detectable only at laparotomy , might be ignored and left untreated ."
281623526,suspected,are,treated,empiric antibiotics,9,9,11,11,12,12,14,15,"As a result , up to 200 neonates with suspected sepsis are treated with empiric antibiotics for every 1 case of microbiologically confirmed sepsis ."
281935018,chronic lymphatic leukaemia,are,treated,allogeneic transplantation,3,5,11,11,13,13,15,16,"Selected patients with chronic lymphatic leukaemia , multiple myeloma and lymphoma are also treated with allogeneic transplantation ."
281935018,multiple myeloma,are,treated,allogeneic transplantation,7,8,11,11,13,13,15,16,"Selected patients with chronic lymphatic leukaemia , multiple myeloma and lymphoma are also treated with allogeneic transplantation ."
282034133,those unsuitable,are,treated,mineralocorticoid receptor antagonists,11,12,16,16,18,18,21,23,"  In contrast , patients with bilateral adrenal hyperplasia , or those unsuitable for surgery , are optimally treated medically with mineralocorticoid receptor antagonists ."
282034133,bilateral adrenal hyperplasia,are,treated,mineralocorticoid receptor antagonists,6,8,16,16,18,18,21,23,"  In contrast , patients with bilateral adrenal hyperplasia , or those unsuitable for surgery , are optimally treated medically with mineralocorticoid receptor antagonists ."
282196172,deficit,are,treated,the psychostimulant methylphenidate,3,3,9,9,10,10,17,19,Children with attention deficit hyperactivity disorder ( ADHD ) are treated for extended periods of time with the psychostimulant methylphenidate ( MPD ) .
282252815,advanced cervical cancer,are,treated,carbo-RT,2,4,6,6,7,7,9,9,"Patients with advanced cervical cancer who are treated with carbo-RT have similar 3-years overall survival , progression free survival , overall response rate , and toxic effects when compared to cis-RT-treated patients ."
282254733,chronic pain,are,treated,paracetamol,2,3,4,4,5,5,7,7,"Children with chronic pain are treated with paracetamol or NSAIDs , whereas adults usually receive Cox-2 inhibitors ."
282254733,chronic pain,are,treated,NSAIDs,2,3,4,4,5,5,9,9,"Children with chronic pain are treated with paracetamol or NSAIDs , whereas adults usually receive Cox-2 inhibitors ."
282296802,rheumatoid arthritis,are,treated,disease-modifying antirheumatic drugs,6,7,22,22,23,23,25,27,The vast majority of patients with rheumatoid arthritis ( RA ) included in the national database of the German Collaborative Arthritis Centers are treated with disease-modifying antirheumatic drugs ( DMARD ) .
282410249,hematooncological disease,are,treated,broad-spectrum antibiotics,2,3,10,10,12,12,16,17,Patients with hematooncological disease or HIV infection and febrile episodes are usually treated in hospital with broad-spectrum antibiotics .
282410249,febrile episodes,are,treated,broad-spectrum antibiotics,8,9,10,10,12,12,16,17,Patients with hematooncological disease or HIV infection and febrile episodes are usually treated in hospital with broad-spectrum antibiotics .
282521912,stage IIIC-IV epithelial ovarian cancer,are,treated,a first cytoreduction,21,25,30,30,31,31,33,35,"The aim of the present study is to evaluate and validate the PSDSS score as a prognostic tool in patients with stage IIIC-IV epithelial ovarian cancer ( EOC ) who are treated with a first cytoreduction with peritonectomy procedures and HIPEC , and to discuss the usefulness and applicability of this approach in decision making in clinical practice ."
282767935,moderate to severe Crohn 's disease,are,treated,corticosteroids,2,7,8,8,9,9,11,11,"Patients with moderate to severe Crohn 's disease are treated with corticosteroids , azathioprine , 6-mercaptopurine , or anti-tumor necrosis factor agents ( e.g. , infliximab , adalimumab ) ."
282767935,moderate to severe Crohn 's disease,are,treated,azathioprine,2,7,8,8,9,9,13,13,"Patients with moderate to severe Crohn 's disease are treated with corticosteroids , azathioprine , 6-mercaptopurine , or anti-tumor necrosis factor agents ( e.g. , infliximab , adalimumab ) ."
282767935,moderate to severe Crohn 's disease,are,treated,6-mercaptopurine,2,7,8,8,9,9,15,15,"Patients with moderate to severe Crohn 's disease are treated with corticosteroids , azathioprine , 6-mercaptopurine , or anti-tumor necrosis factor agents ( e.g. , infliximab , adalimumab ) ."
282767935,moderate to severe Crohn 's disease,are,treated,anti-tumor necrosis factor agents,2,7,8,8,9,9,18,21,"Patients with moderate to severe Crohn 's disease are treated with corticosteroids , azathioprine , 6-mercaptopurine , or anti-tumor necrosis factor agents ( e.g. , infliximab , adalimumab ) ."
282822121,a shorter interval,are,treated,a single nonplatinum agent,35,37,38,38,40,40,42,45,"In this model , patients whose penultimate platinum compound exposure ( platinum-free interval [ PFI ] ) is longer than 6 months are generally offered a platinum agent or a platinum-containing doublet ; those with a shorter interval are usually treated with a single nonplatinum agent ."
283625818,infantile spasms,are,treated,adrenocorticotropic hormone,2,3,11,11,12,12,14,15,"Patients with infantile spasms , an intractable epileptic disorder , often are treated with adrenocorticotropic hormone ."
283767990,benign adnexal masses,are,treated,an inadequate endoscopic technique,3,5,12,12,14,14,19,22,"Many patients with benign adnexal masses , such as ovarian endometrioma , are still treated by laparotomy or with an inadequate endoscopic technique ."
283922644,suspected gastrointestinal irAEs,are,treated,glucocorticoids,3,5,6,6,7,7,10,10,Many patients with suspected gastrointestinal irAEs are treated empirically with glucocorticoids based on typical symptoms .
283944804,isolated dysphasia,are,treated,IVT,6,7,8,8,9,9,11,11,A low proportion of patients with isolated dysphasia are treated with IVT .
284052812,amyotrophic lateral sclerosis,are,treated,the antiglutamatergic drug riluzole,2,4,9,9,10,10,12,15,Patients with amyotrophic lateral sclerosis ( ALS ) who are treated with the antiglutamatergic drug riluzole receive a fixed-dose regimen of 50 mg b.i.d .
284292842,overt hypothyroidism,are,treated,lifelong thyroid hormone therapy,5,6,7,7,9,9,11,14,Patients with Hashimoto thyroiditis and overt hypothyroidism are generally treated with lifelong thyroid hormone therapy .
284481365,"localized , high-risk prostate cancer",are,treated,surgery,3,7,8,8,10,10,12,12,"Patients with clinically localized , high-risk prostate cancer are often treated with surgery , but exhibit variable prognosis requiring long-term monitoring ."
284530802,early rheumatoid arthritis,are,treated,combination disease-modifying anti-rheumatic drugs,20,22,26,26,27,27,29,32,Recent guidance published in the UK by the National Institute for Health and Clinical Excellence has recommended that patients with early rheumatoid arthritis ( RA ) are treated with combination disease-modifying anti-rheumatic drugs ( DMARDs ) .
284557463,gastroesophageal reflux disease,are,treated,proton pump inhibitors,2,4,8,8,9,9,11,13,Patients with gastroesophageal reflux disease ( GERD ) are treated with proton pump inhibitors ( PPIs ) .
