sentence_id,treatment,medical,treatment_first_index,treatment_last_index,medical_first_index,medical_last_index,sentence_text
213088304,Gene transfer therapy,retinal dystrophies,0,2,9,10,"Gene transfer therapy is the most promising cure for retinal dystrophies and has primarily been applied for recessive null conditions via a viral gene expression vector transferring a cDNA encoding an enzyme or channel protein , and targeting expression to one cell type ."
215461022,HLA-matched bone marrow transplantation,nonmalignant hematological disorders,0,3,11,13,"HLA-matched bone marrow transplantation ( BMT ) is a cure for nonmalignant hematological disorders ; however , rejection rates are high and correlate with the number of antecedent transfusions ."
215461022,BMT,nonmalignant hematological disorders,5,5,11,13,"HLA-matched bone marrow transplantation ( BMT ) is a cure for nonmalignant hematological disorders ; however , rejection rates are high and correlate with the number of antecedent transfusions ."
216729848,Laser depilation,pilonidal disease,0,1,13,14,Laser depilation in the natal cleft is by no means a cure for pilonidal disease .
219844707,transplantation,end-stage organ disease,4,4,10,12,The article discusses how transplantation is not a cure for end-stage organ disease but an alternative form of treatment with both potential medical and psychosocial problems .
220270465,Bone marrow transplantation,inherited,0,2,15,15,Bone marrow transplantation ( BMT ) is the only known cure for a variety of inherited diseases and requires the administration of high doses of immunosuppressive and myeloablative therapy .
220270465,BMT,inherited,4,4,15,15,Bone marrow transplantation ( BMT ) is the only known cure for a variety of inherited diseases and requires the administration of high doses of immunosuppressive and myeloablative therapy .
222232435,this breakthrough combination therapy,the vast majority of patients with CF,5,8,15,21,"The question remains : Is this breakthrough combination therapy the "" magic-bullet "" cure for the vast majority of patients with CF ?"
222398478,HSCT,marrow failure,6,6,13,14,Allogeneic hematopoietic stem cell transplantation ( HSCT ) is the only cure for marrow failure associated with dyskeratosis congenita ( DC ) .
223984843,Empathy,dysfunctional shame,0,0,6,7,"Empathy should be a cure for dysfunctional shame , at the individual or social level ."
226785562,oligodendrocyte progenitor cells transplantation therapy,such symptoms,1,5,11,12,"Although oligodendrocyte progenitor cells transplantation therapy is an effective cure for such symptoms , there is no readily available source of these cells ."
228762470,LDLT,classical MSUD,0,0,8,9,LDLT from non-heterozygous donors is a cure for classical MSUD .
234653332,Hematopoietic cell transplant,hematologic and oncologic diseases,0,2,14,17,Hematopoietic cell transplant ( HCT ) is the only cure for a variety of hematologic and oncologic diseases .
234653332,HCT,hematologic and oncologic diseases,4,4,14,17,Hematopoietic cell transplant ( HCT ) is the only cure for a variety of hematologic and oncologic diseases .
236758563,Radiotherapy,several types of solid tumours,0,0,6,10,"Radiotherapy is a powerful cure for several types of solid tumours , but its application is often limited because of severe side effects in individual patients ."
238052072,Liver transplant,hepatic malignancy,0,1,10,11,Liver transplant is a potential cure for liver failure and hepatic malignancy but there are many techniques which have been described for vascular reconstruction .
243559947,Allogeneic cellular gene therapy,congenital hemoglobinopathies,0,3,15,16,Allogeneic cellular gene therapy through hematopoietic stem cell transplantation is the only radical cure for congenital hemoglobinopathies like thalassemia and sickle cell anemia .
247364509,liver transplantation,hepatocellular cancer,2,3,9,10,"Currently , liver transplantation is the optimal cure for hepatocellular cancer ( HCC ) limited to the liver ."
253816933,the vagus nerve,this neurovascular compression syndrome,3,5,15,18,Microvascular decompression of the vagus nerve has been demonstrated to be a potential cure for this neurovascular compression syndrome .
256198590,Hematopoietic stem cell ( HSC ) transplantation,hematological malignancies,0,6,13,14,Hematopoietic stem cell ( HSC ) transplantation can be a potential cure for hematological malignancies and some nonhematologic diseases .
256198590,Hematopoietic stem cell ( HSC ) transplantation,some nonhematologic diseases,0,6,16,18,Hematopoietic stem cell ( HSC ) transplantation can be a potential cure for hematological malignancies and some nonhematologic diseases .
256309431,allogeneic hematopoietic stem cell transplantation,many inborn errors of metabolism,10,14,1,5,"For many inborn errors of metabolism ( IEM ) , allogeneic hematopoietic stem cell transplantation ( HSCT ) is the only cure ."
256309431,HSCT,many inborn errors of metabolism,16,16,1,5,"For many inborn errors of metabolism ( IEM ) , allogeneic hematopoietic stem cell transplantation ( HSCT ) is the only cure ."
259325363,the artificial anal sphincter system,human anal incontinence problems,4,8,14,17,In vitro experiments demonstrate the artificial anal sphincter system is a good cure for human anal incontinence problems .
259838682,transplantation,endothelial diseases,3,3,10,11,"At this point transplantation is the only possible cure for endothelial diseases , such as Fuchs endothelial dystrophy ."
259858876,Hematopoietic stem cell transplantation,many hematological diseases,0,3,12,14,Hematopoietic stem cell transplantation ( HSCT ) is a definite cure for many hematological diseases .
259858876,HSCT,many hematological diseases,5,5,12,14,Hematopoietic stem cell transplantation ( HSCT ) is a definite cure for many hematological diseases .
259917572,dentists,periods that are too short,6,6,11,15,"However , surveys have shown that dentists tend to cure for periods that are too short ."
260854676,Transplantation,end-stage organ failure,0,0,6,8,Transplantation is the only cure for end-stage organ failure .
267883772,Early treatment,periampullary cancer,0,1,8,9,Early treatment is the only potential cure for periampullary cancer .
274820514,Induced antitumor immunity,metastatic tumors,0,2,15,16,"Induced antitumor immunity is a highly effective and long-term cure for cancer , particularly for metastatic tumors ."
275143137,Living donor liver transplantation,fulminant hepatitis,0,3,12,13,Living donor liver transplantation ( LDLT ) is the ultimate cure for fulminant hepatitis .
275143137,LDLT,fulminant hepatitis,5,5,12,13,Living donor liver transplantation ( LDLT ) is the ultimate cure for fulminant hepatitis .
276690479,allo-HSCT,paroxysmal nocturnal hemoglobinuria,6,6,14,16,"Allogeneic hematopoietic stem cell transplantation ( allo-HSCT ) is the sole potential cure for paroxysmal nocturnal hemoglobinuria ( PNH ) ; however , the data on its utility in PNH are limited ."
277339854,Reproductive technologies,social problems,0,1,7,8,Reproductive technologies are not the cure for social problems .
277436619,Mitochondrial transfer,many diseases,9,10,16,17,Mitochondrial transplantation-a possible therapeutic for mitochondrial dysfunction ? : Mitochondrial transfer is a potential cure for many diseases but proof of efficacy and safety is still lacking .
278028322,nucleolysis,herniated,9,9,18,18,"If correct indications and rigorous technique are applied , nucleolysis with chymopapain can be an effective cure for herniated nucleus pulposus in patients who do not respond to adequate medical treatment ."
281719784,CURE,acute coronary syndromes,1,1,5,7,Is CURE a cure for acute coronary syndromes ? Statistical versus clinical significance .
286292828,Hematopoietic stem cell transplantation,the hematopoietic manifestations of FA,0,3,10,14,Hematopoietic stem cell transplantation is the only proven cure for the hematopoietic manifestations of FA and aggressive lifelong surveillance for solid tumors is essential .
286716409,CHM,a broad range of mental illnesses,0,0,10,15,"CHM is an efficient , safe and affordable cure for a broad range of mental illnesses ."
287214689,Orthotopic liver transplantation,end-stage liver failure,0,2,9,11,Orthotopic liver transplantation remains the only proven cure for end-stage liver failure .
290970998,Surgery,neuroendocrine tumors,0,0,6,7,"Surgery is the only cure for neuroendocrine tumors ( NETs ) , with R0 resection being critical for successful tumor removal ."
291370252,Islet transplantation,diabetic patients,0,1,7,8,"Islet transplantation is a potential cure for diabetic patients , however this procedure is not widely adopted due to the high rate of graft failure ."
293227955,Ablation of the slow pathway,atrioventricular nodal reentrant tachycardia,0,4,10,13,Ablation of the slow pathway is an established cure for atrioventricular nodal reentrant tachycardia ( AVNRT ) .
293752498,lung transplantation,this deadly disease,11,12,18,20,"Pulmonary vasodilators offer only limited haemodynamic and exertional benefits , and lung transplantation remains the only cure for this deadly disease ."
299175440,Tizanidine,chronic daily headache,0,0,6,8,Tizanidine is not a cure for chronic daily headache .
299875898,melatonin,sleepless nights,1,1,6,7,Could melatonin be the cure for sleepless nights ?
300011487,sleep,many ills,62,62,67,68,"To explore our claim , we provide 4 examples of empirical insights ( relevant to probably all ethnic groups on Earth ) into causal phenomena predicted by CS : ( i ) "" humans must have a sense of time "" , ( ii ) "" at extreme latitudes , more people have the winter blues "" , ( iii ) "" sleep is a cure for many ills "" and ( iv ) "" social networks affect health and disease "" ."
300338010,lithium carbonate,human cyclic hematopoiesis,3,4,11,13,We conclude that lithium carbonate is not a simple cure for human cyclic hematopoiesis .
303102714,Allogeneic haematopoietic stem cell transplantation,juvenile myelomonocytic leukaemia,0,4,13,15,"Allogeneic haematopoietic stem cell transplantation ( allo-HSCT ) is the only cure for juvenile myelomonocytic leukaemia ( JMML ) , but relapse remains the major cause of failure ."
303102714,allo-HSCT,juvenile myelomonocytic leukaemia,6,6,13,15,"Allogeneic haematopoietic stem cell transplantation ( allo-HSCT ) is the only cure for juvenile myelomonocytic leukaemia ( JMML ) , but relapse remains the major cause of failure ."
304630300,Surgical resection,non-small-cell carcinoma,0,1,7,8,"Surgical resection is the only cure for non-small-cell carcinoma , although radiotherapy and chemotherapy may shrink some tumors ."
306987078,Pulmonary endarterectomy,operable disease,0,1,11,12,Pulmonary endarterectomy ( PEA ) is a potential cure for technically operable disease .
306987078,PEA,operable disease,3,3,11,12,Pulmonary endarterectomy ( PEA ) is a potential cure for technically operable disease .
308582879,Liver transplantation,hepatocellular carcinoma,0,1,10,11,Liver transplantation ( LT ) remains the only cure for hepatocellular carcinoma ( HCC ) in many cases .
308582879,LT,hepatocellular carcinoma,3,3,10,11,Liver transplantation ( LT ) remains the only cure for hepatocellular carcinoma ( HCC ) in many cases .
311559543,OA,human hypertrophic scarring,0,0,16,18,OA suppresses hypertrophic scarring in the rabbit ear model and may be an effective cure for human hypertrophic scarring .
313048129,most doctors,ulcerative colitis,20,21,34,35,"Inflammatory bowel disease , which can take the form of ulcerative colitis or Crohn 's disease , is said by most doctors to be incurable , although surgery is sometimes considered a cure for ulcerative colitis but not Crohn 's disease ."
319511187,Parathyroidectomy,primary hyperparathyroidism,0,0,6,7,"Parathyroidectomy is the definitive cure for primary hyperparathyroidism , and no medical therapies have been approved by the Food and Drug Administration for this disorder ."
321149470,Surgical resection,hepato-pancreato-biliary ( HPB ) malignancy,0,1,7,11,Surgical resection is the only cure for hepato-pancreato-biliary ( HPB ) malignancy .
321717927,RNA interference,amyotrophic lateral sclerosis,0,1,10,12,"RNA interference ( RNAi ) is a potential cure for amyotrophic lateral sclerosis ( ALS ) caused by dominant , gain-of-function superoxide dismutase 1 ( SOD1 ) mutations ."
321717927,RNAi,amyotrophic lateral sclerosis,3,3,10,12,"RNA interference ( RNAi ) is a potential cure for amyotrophic lateral sclerosis ( ALS ) caused by dominant , gain-of-function superoxide dismutase 1 ( SOD1 ) mutations ."
330801720,Sch B,several diseases,7,8,17,18,"Due to its large biological properties , Sch B was recorded to be a potent cure for several diseases by targeting several signaling pathways ."
333427660,human leukocyte antigen (HLA)-matched bone marrow transplantation,several nonmalignant hematologic disorders,3,9,17,20,"When successful , human leukocyte antigen (HLA)-matched bone marrow transplantation with reduced-intensity conditioning is a cure for several nonmalignant hematologic disorders that require chronic transfusion , such as sickle cell disease and aplastic anemia ."
333482328,Hematopoietic stem cell transplant,sickle cell disease,0,3,12,14,Hematopoietic stem cell transplant ( HSCT ) is the only cure for sickle cell disease ( SCD ) .
333482328,HSCT,sickle cell disease,5,5,12,14,Hematopoietic stem cell transplant ( HSCT ) is the only cure for sickle cell disease ( SCD ) .
333839364,cryosurgery,"well-defined , noduloulcerative BCC of the trunk",6,6,12,18,"We sought to show histologically that cryosurgery is an effective cure for well-defined , noduloulcerative BCC of the trunk and upper extremities ."
337445863,oligodendrocyte precursor cell ( OPC ) transplantation therapy,several disorders,1,8,14,15,"Although oligodendrocyte precursor cell ( OPC ) transplantation therapy is an effective cure for several disorders , there is no readily available source of these cells ."
343588099,Established treatments,a limited number of patients with severe hemoglobinopathies,0,1,17,24,Established treatments like bone marrow or cord blood transplantation are so far the only real cure for a limited number of patients with severe hemoglobinopathies .
343588099,bone marrow,a limited number of patients with severe hemoglobinopathies,3,4,17,24,Established treatments like bone marrow or cord blood transplantation are so far the only real cure for a limited number of patients with severe hemoglobinopathies .
343588099,cord blood transplantation,a limited number of patients with severe hemoglobinopathies,6,8,17,24,Established treatments like bone marrow or cord blood transplantation are so far the only real cure for a limited number of patients with severe hemoglobinopathies .
344889868,Islet replacement,insulin-dependent diabetes,0,1,7,8,Islet replacement is a promising cure for insulin-dependent diabetes but is limited by a massive early cell death following transplantation .
347040622,Pulmonary endarterectomy,many patients with CTEPH,0,1,10,13,Pulmonary endarterectomy ( PEA ) is a potential cure for many patients with CTEPH .
347040622,PEA,many patients with CTEPH,3,3,10,13,Pulmonary endarterectomy ( PEA ) is a potential cure for many patients with CTEPH .
348567253,Hematopoietic stem cell transplantation,sickle cell disease,0,3,11,13,Hematopoietic stem cell transplantation ( HSCT ) is a cure for sickle cell disease ( SCD ) but frequently results in permanent sterility .
348567253,HSCT,sickle cell disease,5,5,11,13,Hematopoietic stem cell transplantation ( HSCT ) is a cure for sickle cell disease ( SCD ) but frequently results in permanent sterility .
349056564,HSCT,patients with DBA who are transfusion dependent,9,9,1,7,"For patients with DBA who are transfusion dependent , HSCT is the only cure ."
351598140,Hematopoietic cell transplantation,sickle cell disease,0,2,11,13,"Hematopoietic cell transplantation ( HCT ) is the only cure for sickle cell disease ( SCD ) , but engraftment remains challenging in patients lacking matched donors ."
351598140,HCT,sickle cell disease,4,4,11,13,"Hematopoietic cell transplantation ( HCT ) is the only cure for sickle cell disease ( SCD ) , but engraftment remains challenging in patients lacking matched donors ."
356191145,Surgical resection,pancreatic cancer,0,1,8,9,"Surgical resection is the only possible cure for pancreatic cancer , it remains controversial whether extend lymphadenectomy in pancreatoduodenectomy ( EPD ) is better than standard lymphadenectomy in pancreatoduodenectomy ( SPD ) ."
361552273,Lung transplantation,progressive lung fibrosis,0,1,7,9,Lung transplantation is the only cure for progressive lung fibrosis .
366825809,Transplantation,myelodysplastic syndrome,0,0,7,8,Transplantation is the only known cure for myelodysplastic syndrome ( MDS ) .
366835027,allo-SCT,chronic myeloid leukemia,6,6,14,16,"Allogeneic hematopoietic stem cell transplantation ( allo-SCT ) remains the only proven cure for chronic myeloid leukemia ( CML ) , a rare malignancy in childhood ."
367020451,these modalities,the degenerative process,4,5,11,13,"However , none of these modalities is a true cure for the degenerative process ."
370212599,Surgical resection,colorectal liver metastases,0,1,8,10,Surgical resection is the only realistic cure for colorectal liver metastases ; however only 10 - 25 % of cases are initially resectable .
371640423,allogeneic haematopoietic stem cell transplantation,many patients with malignant and non-malignant diseases,2,6,21,27,"Nowadays , allogeneic haematopoietic stem cell transplantation ( allo-HSCT ) is a well-established treatment procedure and often the only cure for many patients with malignant and non-malignant diseases ."
371640423,allo-HSCT,many patients with malignant and non-malignant diseases,8,8,21,27,"Nowadays , allogeneic haematopoietic stem cell transplantation ( allo-HSCT ) is a well-established treatment procedure and often the only cure for many patients with malignant and non-malignant diseases ."
